Full Name,Profile URL,Headline,Comment,Timestamp,Comment URN,Comment Hash,Post URN,Post Hash
Dinesh Menon,https://www.linkedin.com/in/dinesh-menon-0001,"Strategy & Business Leader | Fintech | Marketing Transformation | Digital CX & MarTech | Revenue, Retention & Customer Value",You said it !!!! Protein powders are being made as if there is no tomorrow. Same same same same claims of what's in it each brand. High time the food ministry administered this (and hair re-growth stimulants) industry lest there be all kinds of kidney and other health issues.,2025-08-04T11:53:45.750Z,"urn:li:comment:(activity:7357997583023165440,7358102847353159680)",90ff027650fadb36b5881eb028a89286792038529b63893144d627419a2ae724,urn:li:activity:7357997583023165440,667607e8d223e803437f400ae71762a50896361437d6b7a65642953020b75006
Kanika Raajdev,https://www.linkedin.com/in/kanikaraajdev,"Founder, Mindcog | Strategy + Marketing Communications","Couldn’t agree more. Somewhere along the way, nutrition became a marketing race instead of a mindful choice.",2025-08-04T11:34:42.228Z,"urn:li:comment:(activity:7357997583023165440,7358098051078524928)",bae6aec6b9cf521f15c26058cb840fab0cec9672f43de12ca90e5d2400f05628,urn:li:activity:7357997583023165440,667607e8d223e803437f400ae71762a50896361437d6b7a65642953020b75006
Avi Kapoor,https://www.linkedin.com/in/avi-kapoor-54074b4b,Founder & Chief Consultant | Business Strategy | Market Research & Analytics | Driving Growth for Businesses,Protein is the new oxygen,2025-08-04T11:32:39.436Z,"urn:li:comment:(activity:7357997583023165440,7358097536047337472)",90ff2766b8ab241c3d30c7bb557b6741656627e064af468c28e388faa2b5310f,urn:li:activity:7357997583023165440,667607e8d223e803437f400ae71762a50896361437d6b7a65642953020b75006
Aafreen Qidwai,https://www.linkedin.com/in/aafreen-qidwai-a5796710b,"Talks about Digital Therapeutics, Health Sciences tech, Patient Support program, DTx, SaMd,Patient Engagement, Drug Adherence","People ignore the basics and go for fancy products , thinking it will transform them overnight.",2025-08-04T10:55:42.071Z,"urn:li:comment:(activity:7357997583023165440,7358088235748679681)",7e3a017a3fd63eb995c1ffcd99c5153da9cac3df55a5d7fbbb8c17251528170f,urn:li:activity:7357997583023165440,667607e8d223e803437f400ae71762a50896361437d6b7a65642953020b75006
Gagan Sawhney,https://www.linkedin.com/in/gagan-sahni,"Building GoGoGo™ — Curating Experiences You Love, UX & Product Design Leader, Strategy, Behaviour Change, Driving Al-First Human-Centered Experiences, Enterprise SaaS, Automation & Agentic AI, Enterpreneur, Changemaker",Haha so true. The influencer-to-intake ratio is getting wild. Would be nice if nutrition got back to basics instead of branding theatrics.,2025-08-04T10:55:39.610Z,"urn:li:comment:(activity:7357997583023165440,7358088225426452480)",0dcde568d907e901ba3de77384064fb8a73165577c30109b03b566ee5a33f160,urn:li:activity:7357997583023165440,667607e8d223e803437f400ae71762a50896361437d6b7a65642953020b75006
Ashish k. Singh,https://www.linkedin.com/in/ashishksingh01,"Apps Ads, Google | Business & Marketing Consultant | | Career & Personal Growth Mentor | 1M+ Followers on Social Media",Waiting for the first “influencer-sourced” whey. Hand-scooped after a HIIT session.,2025-08-04T10:49:48.912Z,"urn:li:comment:(activity:7357997583023165440,7358086754492469250)",936b25c7d29180d0d60200b385451f61735c6df2e3c1c62327cb2dea03dc1ada,urn:li:activity:7357997583023165440,667607e8d223e803437f400ae71762a50896361437d6b7a65642953020b75006
Abhinav Verma,https://www.linkedin.com/in/abhinavvverma,Brand Consultant | Marketing Strategist | Educator-In-The-Making,Just hope they taste better than chalk! 😁 ,2025-08-04T10:12:44.057Z,"urn:li:comment:(activity:7357997583023165440,7358077422770044929)",078a27395bd29d3847473422185e3b5da18aeca59e0fac06b8a191faf038cfdb,urn:li:activity:7357997583023165440,667607e8d223e803437f400ae71762a50896361437d6b7a65642953020b75006
Dheep Vora,https://www.linkedin.com/in/dheep-vora-9025b010,Founder & Entrepreneur | Former Finance Professional | Snacking Brand Pioneer | Marathoner & Swimmer,Someone had to say this. I so agree with you! So many selling anything in the name of protein printed in the front of the pack. Read the back label and you’ll know,2025-08-04T09:58:56.615Z,"urn:li:comment:(activity:7357997583023165440,7358073952226684929)",e2df46fda87df2822d0f67002b99ead8ba2f064f46197e9ceffb85591d188dbc,urn:li:activity:7357997583023165440,667607e8d223e803437f400ae71762a50896361437d6b7a65642953020b75006
Yusra Shahid,https://www.linkedin.com/in/yusra-shahiddd,I help Businesses Look Premium & Memorable for Coaches & Founders #graphicdesigner,"Well said. Nutrition should be intentional, not influenced by noise. Trends fade, but habits stay.",2025-08-04T09:52:32.809Z,"urn:li:comment:(activity:7357997583023165440,7358072342427648003)",eac0f710518def81b4a1a7429225532c8c467c23d9c9a8bfd0ccee0adaf070ab,urn:li:activity:7357997583023165440,667607e8d223e803437f400ae71762a50896361437d6b7a65642953020b75006
Apoorva Patel,https://www.linkedin.com/in/apoorva-patel-a8712012,"Building AI-First Global Health Enterprises |GCC |Big-4 DNA |Yale MBA| Strategy, Scale & Systemic Impact",Protein & Exercise 😄 so that your body can metabolize Protein.,2025-08-04T09:22:07.343Z,"urn:li:comment:(activity:7357997583023165440,7358064685868339202)",eaa16238fda978a2f6c4bc4c6794cda80fc34680f8da3667cfcd35afd9a40373,urn:li:activity:7357997583023165440,667607e8d223e803437f400ae71762a50896361437d6b7a65642953020b75006
Abhijeet Gahlawat,https://www.linkedin.com/in/abhijeetgahlawat,"Non-Endemic Ads @ Blinkit | Ex-Zomato, Porsche & Amex | Ad Monetisation & Digital Partnerships (Views are personal)","70%-75% of supplements are mislabeled with fake protein content - but hey, the packaging looks VERY scientific cos its lab tested!
Some powders contain more marketing budget than actual protein molecules 😅 ",2025-08-04T09:21:30.232Z,"urn:li:comment:(activity:7357997583023165440,7358064530213490689)",6e6ca4ac269e665f8c55f1af15f2c933ad282f778cb2d376a370a8917c56f08f,urn:li:activity:7357997583023165440,667607e8d223e803437f400ae71762a50896361437d6b7a65642953020b75006
Chetan Sinha,https://www.linkedin.com/in/chetansinha,Data & AI @ Fractal.ai | Fintech Product Analytics,Every doctor is on their way to buy a vacation home by testing Protein powders or recommending toothpaste!,2025-08-04T09:06:10.335Z,"urn:li:comment:(activity:7357997583023165440,7358060671890018306)",6432d4841411a0507f7b7ae44569e8aad8cb702e4d5ae051dfff4fa4b1221f70,urn:li:activity:7357997583023165440,667607e8d223e803437f400ae71762a50896361437d6b7a65642953020b75006
Khumesh Patil - BAATKARO - Mental Health Matters,https://www.linkedin.com/in/khumesh-patil,Founder & CEO @Baatkaro: Empowering India Through Better Mental Healthcare | Mental Health Activist & Social Entrepreneur | Walked #5000kms Across India To Raise Awareness About Mental Health & Suicide Prevention,Dilip Kumar Now Indian's are moving from Protine to Carbs or Fibres Ye Naya india Hai😂,2025-08-04T08:50:08.135Z,"urn:li:comment:(activity:7357997583023165440,7358056636126507008)",1c544a667156834bb47500d88258d057e105d335fcc3d1dd47cc27ebf02055ac,urn:li:activity:7357997583023165440,667607e8d223e803437f400ae71762a50896361437d6b7a65642953020b75006
Dr Maheshwar Reddy,https://www.linkedin.com/in/dr-maheshwar-reddy-55682415a,Consultant Neurosurgeon and Spine Surgeon @ KIMS Hospitals | Mch Neurosurgery,"So true. 
A simple question in every meal “Where is my protein and fibre” will solve many problems.",2025-08-04T08:45:14.900Z,"urn:li:comment:(activity:7357997583023165440,7358055406214004736)",9dcb164c1803864661dff5f1185e380b9e9cd41700d78eb47f0b5d1642e3f070,urn:li:activity:7357997583023165440,667607e8d223e803437f400ae71762a50896361437d6b7a65642953020b75006
Rajeev Khera (Flour Man),https://www.linkedin.com/in/rajeevkhera,Building ‘Chakki Peesing’ | Creator | Writer,"Bas protein based alcohol brands aur launch ho jaye, poora india protein deficiency free ho jayega. 😀",2025-08-04T08:36:52.949Z,"urn:li:comment:(activity:7357997583023165440,7358053300874735616)",907bea24ebdfda9b0b4dbfeba810d4b7e255f17c74aca904f3d29660d3f59132,urn:li:activity:7357997583023165440,667607e8d223e803437f400ae71762a50896361437d6b7a65642953020b75006
Radhika likhi,https://www.linkedin.com/in/radhika-likhi-20951b29,Brand and Creative Communication Strategist The PRactice | Ex-DDB Mudra I Ex-Cheil I Ex-Contract,"You forgot magnesium. How was the human race even living without it till now? Tablets, under soles cream, drinks, navel drops…",2025-08-04T08:32:47.252Z,"urn:li:comment:(activity:7357997583023165440,7358052270351028224)",eb28c5758d7b6734cfd885516cc7a6b283077d58156a352056ba6de42609a2d9,urn:li:activity:7357997583023165440,667607e8d223e803437f400ae71762a50896361437d6b7a65642953020b75006
Chetan Yadav,https://www.linkedin.com/in/chetanyadavspace,Founder & CEO - Ozone Space | Space Entrepreneur,"Consumers don’t want more options.
They want fewer good ones. Clarity beats clutter every time.",2025-08-04T08:28:52.801Z,"urn:li:comment:(activity:7357997583023165440,7358051286992216064)",cb69eae01f20e4d38a28b456f49364935e3ae9203fff5acc47e4ffd594e1980c,urn:li:activity:7357997583023165440,667607e8d223e803437f400ae71762a50896361437d6b7a65642953020b75006
Dr Debraj Shome,https://www.linkedin.com/in/drdebrajshome,"Surgeon, American Board Certified in Facial Cosmetic Surgery * Governor-At-Large, American College of Surgeons * Healthcare Entrepreneur, 5X Founder, Investor * IG-150K+, YT-102K+ * Best Seller Author| Fitness Expert",Make what sells,2025-08-04T08:26:52.179Z,"urn:li:comment:(activity:7357997583023165440,7358050781066936320)",0f9e63601eaa09baa7f2a9177b80b6157011806b9f27a1d168c735dc78451ead,urn:li:activity:7357997583023165440,667607e8d223e803437f400ae71762a50896361437d6b7a65642953020b75006
Rahul Sharma,https://www.linkedin.com/in/rahul-sharma-9519baa4,IIM Ahmedabad Alumni | Founder at Qurbat - Chain of Retail Stores | Building Successful Retail Ventures,"Haha, so true! Protein brands everywhere, but real nutrition needs awareness—not hype. Purposeful choices always beat marketing noise.",2025-08-04T08:23:22.597Z,"urn:li:comment:(activity:7357997583023165440,7358049902016278529)",19277a4a265dd1a4e715d9f92def6fa412ed5fb0084f3c75251e6e7be24e9872,urn:li:activity:7357997583023165440,667607e8d223e803437f400ae71762a50896361437d6b7a65642953020b75006
Rohan Rajpal,https://www.linkedin.com/in/rohanrajpal,Co Founder @ spurnow.com | AI for Customer Support & Instagram Automation,Thanks for the protein reminder. Gotta hit that count,2025-08-04T08:20:54.716Z,"urn:li:comment:(activity:7357997583023165440,7358049281754214400)",9bde302136649b2271dc7e6ae85f01b13fccb157a8e2785de3bf6786ca59c2f8,urn:li:activity:7357997583023165440,667607e8d223e803437f400ae71762a50896361437d6b7a65642953020b75006
Rohaan Kaul,https://www.linkedin.com/in/rohankaul,"On a mission to make marketing community healthy, wealthy and wise.","At this point, the most disruptive protein brand would be one that just quietly works… and doesn’t shout about it on every reel.",2025-08-04T08:18:26.060Z,"urn:li:comment:(activity:7357997583023165440,7358048658249961472)",eb532f640a4ef6b0f6deb8979a54030026de4e0731e412275fd32bbb27e2ea01,urn:li:activity:7357997583023165440,667607e8d223e803437f400ae71762a50896361437d6b7a65642953020b75006
Aryan Sharma,https://www.linkedin.com/in/aryanshrx,"CEO, Imaginerix 👉 batman but for product metrics","We’re not even consuming protein anymore - just branding it to death. Respect to the ones actually educating over selling.

Back to the base, paneerr!",2025-08-04T08:04:17.873Z,"urn:li:comment:(activity:7357997583023165440,7358045100695834624)",4f97c61afac2e120b2ae0da9309db564857cce254bde14ccc2507956227eea2b,urn:li:activity:7357997583023165440,667607e8d223e803437f400ae71762a50896361437d6b7a65642953020b75006
Srijan Sharma,https://www.linkedin.com/in/srijans,Co-founder ItsHemp & Clixi | VP IIHA | WEF Global Shaper | Hemp Advocate,Dilip Kumar this post is gonna be the rise of #ProtienOverdoseMovement 😂,2025-08-04T08:04:13.430Z,"urn:li:comment:(activity:7357997583023165440,7358045082060558336)",4e20311ead71a9d726f123b0593dd143f2c67dd2c919db84c6fb57dbb8bc1624,urn:li:activity:7357997583023165440,667607e8d223e803437f400ae71762a50896361437d6b7a65642953020b75006
Anshul Garg,https://www.linkedin.com/in/anshul-garg-81bba542,"Finance and Healthy food Enthusiast, Angel Investor, Ex-Vedanta, Ex-KPTL","The reason is simple-We don't want to do research and take time to make products. Everybody is in FOMO. Protein products still comes under ultra processed.
Further India still buys cheap stuff. A handful of people don't make your business. I was surprised when FOOD PHARMER Lunched Protein brand when he was exposing other food items which very hard to manufacture at low cost. He could have tried some innovation in some other food items.",2025-08-04T07:59:17.082Z,"urn:li:comment:(activity:7357997583023165440,7358043839082717184)",9ee0035df61459f1e8796a1f9198edbfe55c0e238dda07292ceb6d0208d5bf55,urn:li:activity:7357997583023165440,667607e8d223e803437f400ae71762a50896361437d6b7a65642953020b75006
Vishal Singh Rathore,https://www.linkedin.com/in/vishal-singh-rathore-4581aa7b,IITJ I Sports Nutrition Entrepreneur I Sports Enthusiast,"Rightly said sir👍Anybody and everybody jumping into the supplement industry because of no regulations least amount of prerequisite knowledge and when you can start a brand of yours with just 5Lakh rupees why wont everybody jump in when they can see the industry boom but the real question is where is the raw protein sourced from and how hygenic and hitech the manufacturing facilities are.
The situation is alarming and it has to be channelised otherwise stopped because it has already caused a lot of clutter in consumer minds.

 
I have tried to address some of the issues according to my understanding and provided solutions to the industry’s prevailing problems. 

https://www.linkedin.com/posts/vishal-singh-rathore-4581aa7b_columbusknows-fssai-fitindia-activity-7350773631683084289-dEZ_?utm_medium=ios_app&rcm=ACoAABDvrAQB4OUYA2Soth88TgWw757sAH4v3zM&utm_source=social_share_send&utm_campaign=copy_link",2025-08-04T07:54:30.171Z,"urn:li:comment:(activity:7357997583023165440,7358042635690799104)",9e025d5a906251c10502e390d7a3914ebfba1a1a5ee1e5ea678fa93a6b522dae,urn:li:activity:7357997583023165440,667607e8d223e803437f400ae71762a50896361437d6b7a65642953020b75006
Aayush Das,https://www.linkedin.com/in/aayush-das,Partner Marketing Manager at Autodesk,"Every brand is offering ""India's cleanest, leanest protein.""",2025-08-04T07:49:44.764Z,"urn:li:comment:(activity:7357997583023165440,7358041438611271680)",b5f4665507322afb02cab9f115dc3673ded458ba93e6fa1ee9df3d48253c53ac,urn:li:activity:7357997583023165440,667607e8d223e803437f400ae71762a50896361437d6b7a65642953020b75006
Santhosh Muruganantham,https://www.linkedin.com/in/santhoshmuruganantham,"Co Founder & M.D at Kolapasi.com , Global Indian Restaurant chain ,The First Indian Chefless Fresh Quick Service Restaurant chain .","After the California gold Rush , may be we are entering the Indian Protein Rush .",2025-08-04T07:46:22.605Z,"urn:li:comment:(activity:7357997583023165440,7358040590690758657)",91f8dfa11b8ea2f988b78a1f21bd164ce4c3077688b6edfe8bc07972567dd75f,urn:li:activity:7357997583023165440,667607e8d223e803437f400ae71762a50896361437d6b7a65642953020b75006
Soumit S.,https://www.linkedin.com/in/soumitsaha27,"Partner | Swiggy, Zepto, Cipla | BITS Pilani","Tried a new product whey chocolate balls the other day, every pc costed 40 Rs and gave 3 Gms Protein. An Egg costs 6 Rs and gives 5 Gms. It's getting outta hand :)",2025-08-04T07:42:30.707Z,"urn:li:comment:(activity:7357997583023165440,7358039618040057858)",1126b2f322caa187f0c6c7773a16872b05d6b98b44027e050acc9cc455ccb51a,urn:li:activity:7357997583023165440,667607e8d223e803437f400ae71762a50896361437d6b7a65642953020b75006
Manjunatha T N,https://www.linkedin.com/in/manjunatha-t-n-46528624,Co-Founder & Co-Driver - EvoBUS,"Hi, Dilip

Earth (more precisely, topsoil) contains all the nutrients (70+) needed for plant growth.

We (Farmers, under the influence of agro chemical companies and the government) are constantly killing the topsoil (i.e. the billions of tiny organisms that feed plants with essential nutrition) by applying toxic chemicals (synthetic fertilizers(contact and systemic) and pesticides/herbicides/growth stimulants and many more).

The same analogy applies to our bodies.

The permanent solution to a healthy body is healthy food.

Healthy food grows in healthy soil.
All health alternatives are just a drama, a big drama.",2025-08-04T07:40:40.090Z,"urn:li:comment:(activity:7357997583023165440,7358039154082893824)",c9e66eb8eae05f6cf7e97d704927feed40da055b1815c3a87a9308447912f721,urn:li:activity:7357997583023165440,667607e8d223e803437f400ae71762a50896361437d6b7a65642953020b75006
Pritam kotian,https://www.linkedin.com/in/pritam-kotian,Founder & CEO at FITTELLY,True 😅,2025-08-04T07:38:33.852Z,"urn:li:comment:(activity:7357997583023165440,7358038624598114304)",b9f967ef332ee165f33cef354ea19ced34b43d6c7fd7c70e4292cb4a61544a86,urn:li:activity:7357997583023165440,667607e8d223e803437f400ae71762a50896361437d6b7a65642953020b75006
Manav Jhaveri,https://www.linkedin.com/in/manavjhaveri2000,"LinkedIn Personal Branding and Ghostwriting for founders, investors and VCs | Content Writer | One interesting thing every day. AI, Tech, Writing, Culture, Psychology.","I don’t like the fact that everyone just races around the fact that they need more protein without actually observing their body and seeing if they need it. This body is very very very subjective for each one of us, check your body before you assume you need a certain amount of protein or if a supplement is needed.",2025-08-04T07:38:17.731Z,"urn:li:comment:(activity:7357997583023165440,7358038556981768192)",9ebd936cc628e47abb893c707f7db0dcd26eac8b037699e2f81012407954bc8a,urn:li:activity:7357997583023165440,667607e8d223e803437f400ae71762a50896361437d6b7a65642953020b75006
Dr. Jyoti Bansal,https://www.linkedin.com/in/dr-jyoti-bansal-470b4847,Founder @ iLiOS Health| Dedicated to a Transparent & Accessible Healthcare for All,"Yes Dilip. Its like milk products outnumber the capacity of milk production. similarly there a massive surge in protein manufacturing, question is whether we have the capacity to produce that much of protein or not. ",2025-08-04T07:28:02.211Z,"urn:li:comment:(activity:7357997583023165440,7358035975307935744)",d992af331918069da0552f65cc7fba8242fc39122654c8787944fc8f6ac2a3b2,urn:li:activity:7357997583023165440,667607e8d223e803437f400ae71762a50896361437d6b7a65642953020b75006
Meghna Gupta,https://www.linkedin.com/in/meghnagupta21,Scaling critical platforms for global impact,"""Nutrition isn't about being part of a trend"" so well put Dilip Kumar... It's surprising how many people treat it just like any other trend... Especially when it comes to health, if one is not willing to put in the effort to educate themselves they should follow what is time tested and ""does not"" ever go ""out of trend"" 🙆",2025-08-04T07:22:40.171Z,"urn:li:comment:(activity:7357997583023165440,7358034624570142721)",b25c43733867757cbb84646f8359955df4dceac9f1146a2559180cb5016986eb,urn:li:activity:7357997583023165440,667607e8d223e803437f400ae71762a50896361437d6b7a65642953020b75006
Tashi ‎,https://www.linkedin.com/in/tashi-dorjay-sherpa,Public Policy & Economics,Can't wait to become a protein in 2026,2025-08-04T07:22:15.692Z,"urn:li:comment:(activity:7357997583023165440,7358034521897799680)",94a67b48f3f3f3dffc7f0a1750a2078153c5fd96e9e2b21d8099a0f3524bc804,urn:li:activity:7357997583023165440,667607e8d223e803437f400ae71762a50896361437d6b7a65642953020b75006
Yash Sharma,https://www.linkedin.com/in/yash-sharma-ys22,Connect Brands with Their Audience & Amplify Founder Voices | Digital Marketing Strategist | 50+ Brands Transformed,"Love this take, Dilip",2025-08-04T07:18:08.854Z,"urn:li:comment:(activity:7357997583023165440,7358033486584164356)",a5638ba900b3e57f05746397419422906ff28b963780222362ae65b8e40a8075,urn:li:activity:7357997583023165440,667607e8d223e803437f400ae71762a50896361437d6b7a65642953020b75006
Vridhi Sharma,https://www.linkedin.com/in/iamvridhisharma,"MBA (HR), SBM, NMIMS Mumbai","True sir
I dont take protein powder but i am really amazed that everyday I am seeing a new clean label protein powder brand",2025-08-04T07:15:35.027Z,"urn:li:comment:(activity:7357997583023165440,7358032841386962948)",e2d2a07fd6b6078c62c1800e4cac64a58022999358971a1de17b0fbcda2edb33,urn:li:activity:7357997583023165440,667607e8d223e803437f400ae71762a50896361437d6b7a65642953020b75006
Amit Katyal,https://www.linkedin.com/in/amit-katyal-8436809,Bookeepers & more,"With the protein market so saturated, what helps you distinguish between purposeful nutrition and marketing hype when choosing a supplement or brand?",2025-08-04T07:15:29.858Z,"urn:li:comment:(activity:7357997583023165440,7358032819706580996)",2271748f5ac3d54a2a67ae12670e594f83dd5a981cd59a20be225edc9006d516,urn:li:activity:7357997583023165440,667607e8d223e803437f400ae71762a50896361437d6b7a65642953020b75006
Samar Sisodia,https://www.linkedin.com/in/samar-sisodia,2X Founder | Entrepreneur | Scaled First Startup to $1M Revenue in Under 2.5 Years | 2X [0-1] | You Tube 100K+ Subscribers,It's becoming more of a FOMO now.,2025-08-04T07:13:22.764Z,"urn:li:comment:(activity:7357997583023165440,7358032286639882240)",4d76f926bee2c51bb817a473d94a00405dd5502d3687d95fcf2c0b7ca5505728,urn:li:activity:7357997583023165440,667607e8d223e803437f400ae71762a50896361437d6b7a65642953020b75006
Shweta Modgil,https://www.linkedin.com/in/shweta-modgil-2733405,Talent & Tech Evangelist | Strategy and Thought Leadership | Published Author,"Yes, protein is like the new AI in health 😄 ",2025-08-04T07:03:59.852Z,"urn:li:comment:(activity:7357997583023165440,7358029925611655169)",6c7f5e315387384861753846cc91abc790768673b17dec424a5f5abf22e4d4cf,urn:li:activity:7357997583023165440,667607e8d223e803437f400ae71762a50896361437d6b7a65642953020b75006
Harsh Jayesh Ruparel,https://www.linkedin.com/in/harsh-ruparel,Commbitz eSIM Co-Founder & CEO | Travel Tech | eSIM Platform | eSIM for B2B / B2C / B2E / D2C Growth | Telecom Innovation | Travel eSIM Solutions,"Haha so true! It really feels like everyone is selling protein these days but in the end, it’s not about what’s trending...it’s about what your body actually needs.",2025-08-04T07:02:59.038Z,"urn:li:comment:(activity:7357997583023165440,7358029670543499264)",a76e03db1c777b4a31013e418d9589eb52c1399691309aa606e4505f8c88c401,urn:li:activity:7357997583023165440,667607e8d223e803437f400ae71762a50896361437d6b7a65642953020b75006
Ashish Verma,https://www.linkedin.com/in/ashish-verma-performance-marketing,Worked with 80+ clients. 500cr+ in revenue.86% retention. 70cr plus spends managed!,"At this rate, even my chai might come with 10g protein soon.",2025-08-04T07:02:19.383Z,"urn:li:comment:(activity:7357997583023165440,7358029504214159362)",efa6acc7316a52e3547020d20dda8976c9acf3f82668ad01e48d4613cca13a47,urn:li:activity:7357997583023165440,667607e8d223e803437f400ae71762a50896361437d6b7a65642953020b75006
Vineeta Wagh,https://www.linkedin.com/in/vineeta-wagh-a621a23b,Marketing Consultant | Co-Founder BBL | Ex Xiaomi | Ex Zivame | Product Marketing | Consumer Tech | AIOT Smart Home | D2C | Bengaluru/Pune,There is a protein hair serum as well now :) ,2025-08-04T06:58:08.406Z,"urn:li:comment:(activity:7357997583023165440,7358028451540348928)",b729337670130d5d874c508022cf2e388e863729e7c9809c96f857060496c35a,urn:li:activity:7357997583023165440,667607e8d223e803437f400ae71762a50896361437d6b7a65642953020b75006
Amar Suryakanth,https://www.linkedin.com/in/amar-mukkawar,"Enterprise Sales | Powering B2C Shipping | 10+ Years in Logistics, Edtech & Foodtech","Protein has gained so much attention lately that it has overshadowed the importance of other essential nutrients. In the 1960s and 70s, the focus was on carbohydrates. India saw a carb revolution. Today, the country is in need of a protein shift, and in the future, the spotlight must turn to micronutrients.",2025-08-04T06:57:08.395Z,"urn:li:comment:(activity:7357997583023165440,7358028199835971585)",b1f3855f5b1a57a00f48bb7fd1ba065a1836011dbb0e9097b38a29615860e516,urn:li:activity:7357997583023165440,667607e8d223e803437f400ae71762a50896361437d6b7a65642953020b75006
Trishala Bothra,https://www.linkedin.com/in/trishala-bothra-302604b8,"Co-founder, Habuild || LBS || IIT Bombay","At this rate, I’ll need a protein powder just to recover from all the protein marketing 😅",2025-08-04T06:56:35.157Z,"urn:li:comment:(activity:7357997583023165440,7358028060425646080)",d29993bcb5b15ef2706da4304ded15781bafb8f417d334c7baa8944a9f95e721,urn:li:activity:7357997583023165440,667607e8d223e803437f400ae71762a50896361437d6b7a65642953020b75006
Ashima Prashar,https://www.linkedin.com/in/ashima-tells-your-story,"Copywriter & Creative Director, here to help you generate leads, turn visitors to buyers, & repeat growth","So truuee! Also, please eat enough fiber, and drink enough water for proper assimilation and to avoid long term digestive issues 🥹",2025-08-04T06:45:45.664Z,"urn:li:comment:(activity:7357997583023165440,7358025336254578688)",ebe721e4fcde0f6a79a19b631094448855ec7e22d81ac30a0d2b4759ffefa6a0,urn:li:activity:7357997583023165440,667607e8d223e803437f400ae71762a50896361437d6b7a65642953020b75006
