Full Name,Profile URL,Headline,Comment,Timestamp,Comment URN,Comment Hash,Post URN,Post Hash
Pia Singh 🧠,https://www.linkedin.com/in/pia-singh,"Founder - MindSmith | Oxford SBS, Yale SOM | ex-SBI, ex-RBS, ex-BNP",I feel the same for Mental Health Dilip Kumar,2025-08-04T06:41:34.717Z,"urn:li:comment:(activity:7357997583023165440,7358024283706544128)",0114a450e5ff94f0e2aceaf7e53b1b2b05186ada5238c99cced0835191f0dc0d,urn:li:activity:7357997583023165440,667607e8d223e803437f400ae71762a50896361437d6b7a65642953020b75006
Shailesh Gaikwad,https://www.linkedin.com/in/shailesh-gaikwad,Founder @ Dollar Burger | Co-Founder @ English Bol,"Next pitch idea: Protein + Coffee = Proffee
Unlimited TAM, SAM, SOM, STD, ISD, PCO.",2025-08-04T06:40:02.393Z,"urn:li:comment:(activity:7357997583023165440,7358023896471658498)",035bcd9a08137f65d0c87395ee3e3481c6687ef804cff2096845c5679da4cc4b,urn:li:activity:7357997583023165440,667607e8d223e803437f400ae71762a50896361437d6b7a65642953020b75006
Reena Meena,https://www.linkedin.com/in/reena-meena-512768210,Founder & CEO @ Upsprout | F&B Product & Sourcing Specialist |50+ Product Launches| Consultant,"Brands are still heavily focused on protein powders and bars, but the real opportunity lies in integrating protein into everyday food - making it a natural, effortless part of daily diets.",2025-08-04T06:39:53.642Z,"urn:li:comment:(activity:7357997583023165440,7358023859767267330)",4e57aa840d2bf81c4beb2b761ae16b928eab9417c27597d6c9fcb50c5f2077db,urn:li:activity:7357997583023165440,667607e8d223e803437f400ae71762a50896361437d6b7a65642953020b75006
Secure IT Simply Technology Services,,"1,878 followers","When the noise drowns the message, real value gets lost purposeful nutrition always wins over flashy claims Dilip Kumar.",2025-08-04T06:36:43.828Z,"urn:li:comment:(activity:7357997583023165440,7358023063629713408)",5db105feb9987bed81409fec56b556a37c029b54a28465fe910c85e55cda01a3,urn:li:activity:7357997583023165440,667607e8d223e803437f400ae71762a50896361437d6b7a65642953020b75006
Anindita Chatterjee,https://www.linkedin.com/in/anindita5,"Writer & Creator | Sharing fresh takes on new-age brands, systems, and work life so you find value here every time ✨","Protein is everywhere, from drinks to snacks but except in our blood reports :) (but again, you become a kidney patient, and your doctor's first advice is ""cut down"" protein) :))) Dilip Kumar",2025-08-04T06:32:32.664Z,"urn:li:comment:(activity:7357997583023165440,7358022010175684608)",fdcda72bb4627fedb1cd4d94a45f403add04efb20ccd7ed7676ea32d7744b162,urn:li:activity:7357997583023165440,667607e8d223e803437f400ae71762a50896361437d6b7a65642953020b75006
Bhavika Jain,https://www.linkedin.com/in/bhavika-jain-378304169,"Bringing you hyper personalised-beauty platform, at your fingertips, soon.",And every protein brand makes you feel lighter and no bloating! ,2025-08-04T06:28:11.984Z,"urn:li:comment:(activity:7357997583023165440,7358020916800303104)",85efac10a10fb37fdcb20f6843ea3f3c8a7a9709817f45d7ea0ce50627990e40,urn:li:activity:7357997583023165440,667607e8d223e803437f400ae71762a50896361437d6b7a65642953020b75006
Suresh Kumar,https://www.linkedin.com/in/suresh336,Co-Founder @ The Elevate Yoga | Making True Wellness Accessible & Affordable.,"So well said 😅
 We’re seeing more protein brands than people actually moving their bodies.
At Elevate, we keep it simple — nutrition is important, but without mindful movement, breathwork, and proper rest, no powder can do the magic alone.
It’s not about trends, it’s about sustainable habits.
 Move with intention, eat with awareness, and let wellness be personal — not performative. 🙌",2025-08-04T06:20:29.295Z,"urn:li:comment:(activity:7357997583023165440,7358018976142024705)",ca1f3195735819aa13a3a0bf0905d87e78f4d8d8e0633d05a56ebedde215164e,urn:li:activity:7357997583023165440,667607e8d223e803437f400ae71762a50896361437d6b7a65642953020b75006
Nikunj K Dujari,https://www.linkedin.com/in/nikunj-dujari,Brand-first GTM Architect I Fractional CMO I Entrepreneur I Scaled-up companies from 0 to 1,The startup world in India has a recurring theme chasing categories instead of solving real problems. A couple of years back it was personal care and coffee. Today it's protein and lab grown diamonds.,2025-08-04T06:19:49.729Z,"urn:li:comment:(activity:7357997583023165440,7358018810190118912)",884b23f0cc012b947af9c297917b1140c62b15380edfe327fe8971284533323b,urn:li:activity:7357997583023165440,667607e8d223e803437f400ae71762a50896361437d6b7a65642953020b75006
Kedar Kavekar,https://www.linkedin.com/in/kedar-kavekar-b3a00325,"Food Safety, Quality & Product Development | Regulatory Compliance | PCQI FSMA, | FSSC Lead Auditor | Pet Food Nutritionist | Human Food | Learner | Un-learner",Couldn’t agree more !,2025-08-04T06:16:36.670Z,"urn:li:comment:(activity:7357997583023165440,7358018000441982977)",4b1c4be4703a4bf5763436352fbb46ad97e0d8409cbf59d7c44325f682c9371e,urn:li:activity:7357997583023165440,667607e8d223e803437f400ae71762a50896361437d6b7a65642953020b75006
Shilpa Khadilkar,https://www.linkedin.com/in/shilpakhadilkar,Founder & Formulator at Renewtra | Renewing Nutrition | Labels Without Lies |,"Just like AI, Fintech, Deep-tech, Health-tech... blah blah blah... By the way I am eagerly waiting for protein alcohol now that we already have prebiotic cola!",2025-08-04T06:10:40.380Z,"urn:li:comment:(activity:7357997583023165440,7358016506053459969)",34e9d62c5183328a33abd4fb1e96ca9f0449cbf1fb28e8e9350bdc642cf935be,urn:li:activity:7357997583023165440,667607e8d223e803437f400ae71762a50896361437d6b7a65642953020b75006
Dr. Shweta Patel,https://www.linkedin.com/in/dr-shweta-patel-0a9703106,"Founder of BodyKraft Physio, Goreagon","True! It’s like Shark Tank meets gym bros at this point 😂 Everyone’s selling scoops of science and hope. Love the reminder,nutrition should be personal, not promotional",2025-08-04T06:10:37.725Z,"urn:li:comment:(activity:7357997583023165440,7358016494917554176)",6a030e130fab5c782f3d16604a448de4b1cdf9b1ce031124e029cf7746e392fa,urn:li:activity:7357997583023165440,667607e8d223e803437f400ae71762a50896361437d6b7a65642953020b75006
