Full Name,Profile URL,Headline,Comment,Timestamp,Comment URN,Comment Hash,Post URN,Post Hash
Tanmay Jain,https://www.linkedin.com/in/tanmay-jain-b06b3aa2,"Co-Founder, ZenZebra CA|CFA|LLB",Wish more people knew about ZenZebra,2025-08-30T05:35:07.122Z,"urn:li:comment:(activity:7357997583023165440,7367429643026513920)",9d253ce8a723dd7068974020005a5e79cb05a56496cf7e792e941dab0c229e88,urn:li:activity:7357997583023165440,667607e8d223e803437f400ae71762a50896361437d6b7a65642953020b75006
Nikhil Rana,https://www.linkedin.com/in/nikhil-rana-04b5b2111,Is a headline mandatory?,"Egg whites, chicken breast crying in the corner 😂",2025-08-26T11:01:56.258Z,"urn:li:comment:(activity:7357997583023165440,7366062338241675265)",bd522716d3d3bb061f0b5d4f946da086e534936bfe07cc58fe0bd39c78b0f97a,urn:li:activity:7357997583023165440,667607e8d223e803437f400ae71762a50896361437d6b7a65642953020b75006
Shweta Jain,https://www.linkedin.com/in/shweta-jain-3bbb51105,"Clinical Nutritionist | Virtual Sales Admin at Lushin, Inc. | Powered by Sandler Training | Content Writer","It's still only in the ads, not on the plates of maximum Indians. 
It's still the ""kidney kharaab karne wala powder"" in indian households.

Knowledge is the key, and we're trying to educate people about the importance of protein in their diets.",2025-08-26T06:54:35.516Z,"urn:li:comment:(activity:7357997583023165440,7366000091662348289)",f4dc86ec9ce5ea9e04709b4b90ac6b8373b4e6728bc9074008c2284cdd9738b4,urn:li:activity:7357997583023165440,667607e8d223e803437f400ae71762a50896361437d6b7a65642953020b75006
Prashanth Gaddampally,https://www.linkedin.com/in/prashanthgaddampally,Corporate Leader | Hybrid Athlete I Fitness Educator & Mentor SFSA | Empowering Busy Professionals Build Sustainable Health & Fitness,"Agree, so many new brands launching around but still consumers don't have clarity, trust and myths will continue",2025-08-20T14:48:10.450Z,"urn:li:comment:(activity:7357997583023165440,7363944945335889922)",e3e2e30b8b3a081a49c0759abc3e78d5b3b78fe9ca0da6dfadf824ea178cbb82,urn:li:activity:7357997583023165440,667607e8d223e803437f400ae71762a50896361437d6b7a65642953020b75006
Prithwish Mukherjee,https://www.linkedin.com/in/prithwish-mukherjee-51b936324,Clinical Pet Nutritionist | Pet Food & Supplement Formulator | Author | Small Animal Nutrition Researcher OCRiD: 0009-0003-3337-3807 WOS ResearcherID: OUJ-7249-2025,WHEY too much 🥱,2025-08-13T11:43:07.863Z,"urn:li:comment:(activity:7357997583023165440,7361361662651547648)",2164520b570ee5bed7e80bf8c5100adab1799eb86e5061ae2a928e2ffef9b489,urn:li:activity:7357997583023165440,667607e8d223e803437f400ae71762a50896361437d6b7a65642953020b75006
Arunima Singhdeo,https://www.linkedin.com/in/arunima,Founder & CEO @ Shvasa | Serial Entrepreneur & Wellness Expert,Haha true,2025-08-12T10:54:07.767Z,"urn:li:comment:(activity:7357997583023165440,7360986943133806592)",68bf1b52e1ab192658a22e954f385aeda5767a36849b65c169e49941a4d1c97b,urn:li:activity:7357997583023165440,667607e8d223e803437f400ae71762a50896361437d6b7a65642953020b75006
Aditya Dalmia,https://www.linkedin.com/in/adityadalmia84,Director at SAA VISHNU BAKERS PRIVATE LIMITED | Building @Vishnu Delight | Contract Manufacturing Partner(SPECIALIST) for Leading FMCG Brands |Committed to Pioneering Healthy Snacking & Expanding Global Market Reach | EO,"Love this take! So true protein brands are booming, but real impact comes from purposeful nutrition, not just hype. Quality and relevance over noise, always.",2025-08-08T11:11:45.007Z,"urn:li:comment:(activity:7357997583023165440,7359541826057351168)",c815971e53857b27b2168f2f28df6500e3a54d97d2197e85efb47ba2b2f81c58,urn:li:activity:7357997583023165440,667607e8d223e803437f400ae71762a50896361437d6b7a65642953020b75006
VISHWANATH S.,https://www.linkedin.com/in/vishwanath-s-b4aa55a0,,Well said,2025-08-07T12:03:28.593Z,"urn:li:comment:(activity:7357997583023165440,7359192455570743296)",bd261df713fff5ee363d623d158bf39328bcfab232d3932fcfdb6f9982ff0bb0,urn:li:activity:7357997583023165440,667607e8d223e803437f400ae71762a50896361437d6b7a65642953020b75006
Harsha D.,https://www.linkedin.com/in/mypatentstrategist,Patent Strategy expert | BOSCH India,Well said Dilip,2025-08-06T16:34:56.436Z,"urn:li:comment:(activity:7357997583023165440,7358898383870177283)",beabc8e8fe1b242f998ec3b8c2439f39cebfdff40faf27a228e9e1104abda3f1,urn:li:activity:7357997583023165440,667607e8d223e803437f400ae71762a50896361437d6b7a65642953020b75006
Rtn Rajeev Goenka,https://www.linkedin.com/in/rtn-rajeev-goenka-16b1222,Founder CEO BFY Sports & Fitness-Since 1999 India's oldest fitness academy. Proud Rotarian since 2021. President 24-25 Rotary Club of Mumbai SOBO-Dist 3141 Together we do good.,"Love this take, Dilip
Guess its the Me too ..Follow the Herd mentality !
Wonder how many will last a few years.
Longevity matters in a brand !",2025-08-06T08:07:31.345Z,"urn:li:comment:(activity:7357997583023165440,7358770687903256583)",aa6b55d4a277ca0630754828c3803463c70a6eaff8bf0c7d044e2fd88d20dca1,urn:li:activity:7357997583023165440,667607e8d223e803437f400ae71762a50896361437d6b7a65642953020b75006
Zafer Mukeri,https://www.linkedin.com/in/zafermukeri,₹50+ Cr. in Client Revenue || Building success for Personal/Health/Baby Care brands with Performance Marketing & CRO || Grow your eCommerce brand to 1cr+/month by just EXECUTING on my content. #NothingHeldBack,Surya Tej Chinni what do you think 🤣 ,2025-08-06T07:54:51.840Z,"urn:li:comment:(activity:7357997583023165440,7358767502312525824)",acd5d2f4b773ab81cfc31a5b58a08ba699b3cb685c3d6e4f98f4d803ee644126,urn:li:activity:7357997583023165440,667607e8d223e803437f400ae71762a50896361437d6b7a65642953020b75006
CA Mohnish Vora,https://www.linkedin.com/in/camohnishvora,"CA Educator, IIM Alumni, 2 Lakh+ Students","An interesting case of market over-supply meeting branding fatigue. 

When differentiation shifts from substance to slogans, consumers tend to respond with skepticism.

Purpose-led nutrition, as you’ve pointed out, isn’t built on endorsements. It’s built on trust, consistency, and education.",2025-08-06T06:17:23.025Z,"urn:li:comment:(activity:7357997583023165440,7358742970600181764)",bd78ec3c0dd6de0f9bde8090c607bf46b652880bd8b1b2c25c7f89e5b7cb3106,urn:li:activity:7357997583023165440,667607e8d223e803437f400ae71762a50896361437d6b7a65642953020b75006
Dr. Kartik Mutha (H.c),https://www.linkedin.com/in/itskartikm,"Author: “STUDENTPRENEUR” | Social Entrepreneur | Corporate Wellness | Ex- Indore Municipal Corporation, AiCTSL, | Creator Economy | 1 exit","  You make a great point! The protein market is booming, but we should prioritize quality and informed choices over trends. Let’s focus on nutrition that truly benefits us! 
",2025-08-05T21:01:54.710Z,"urn:li:comment:(activity:7357997583023165440,7358603181515300864)",7e2dd22b90ae06904d57bd849c446138eb5e93fa2cfabc6d182e6ce60b395e68,urn:li:activity:7357997583023165440,667607e8d223e803437f400ae71762a50896361437d6b7a65642953020b75006
Krishan Anand,https://www.linkedin.com/in/krishan-anand-2403878a,Curating India’s Most Exclusive Experiences ⛷ | Founder @ Secret Ski Party | Building Experiential IPs in the Himalayas | Hotelier | Entrepreneur | Redefining the Future of Luxury,"At this rate, my next date might be a protein founder… or worse, a protein powder 😅",2025-08-05T18:19:44.288Z,"urn:li:comment:(activity:7357997583023165440,7358562369167380480)",d5e161f292242345f7a2ec2ec0e0424caa868e14a96c70ec6584985e58a4c5c2,urn:li:activity:7357997583023165440,667607e8d223e803437f400ae71762a50896361437d6b7a65642953020b75006
Parnika Srivastava,https://www.linkedin.com/in/parnika-srivastava-4367b8190,"BCG | MBA, XLRI'25 | Qualified FRM | Cleared CFA L2",Glad someone’s calling this out with clarity (and humour!),2025-08-05T15:46:11.329Z,"urn:li:comment:(activity:7357997583023165440,7358523727220797441)",edcfd1c9aa4bbb81ceb26390b3d7319672930e37b6c22d7e0c6a08e659f6af04,urn:li:activity:7357997583023165440,667607e8d223e803437f400ae71762a50896361437d6b7a65642953020b75006
Hiteshree M. Dudani,https://www.linkedin.com/in/hiteshree-dudani,"Therapist | Co-founder, Moon Minds| Building ethical mental healthcare for Indians, everywhere.","When I saw Amul's protein water, I knew the protein madness is real 😂",2025-08-05T13:05:24.716Z,"urn:li:comment:(activity:7357997583023165440,7358483266393321472)",10fb86a98b1d99ee36011544b2731b2e0df252922e5994ffe09dd96ae2c2007f,urn:li:activity:7357997583023165440,667607e8d223e803437f400ae71762a50896361437d6b7a65642953020b75006
Tapas Chakraborty FIII,https://www.linkedin.com/in/tchakraborty,"Director @ Welfin.in | fellow, Insurance Institute of India, Certified Financial Planner",I agree 💯,2025-08-05T11:08:10.099Z,"urn:li:comment:(activity:7357997583023165440,7358453761066913792)",6ed6e120b8d6bfaa1d2cff4d1ef2784647a3b22d5ba72f8f2847653801f01f8d,urn:li:activity:7357997583023165440,667607e8d223e803437f400ae71762a50896361437d6b7a65642953020b75006
Mandar Pinjarkar,https://www.linkedin.com/in/mandar-pinjarkar-052b87100,Strategic Partnerships & Alliances | Agency Aggregator | I Help Brands Find the Right Agencies & Strategic Partners | D2C Growth | Visiting Faculty (Digital Marketing),"Do we even have these many labs? Are these test even genuine. More the brands, more the doubts :p",2025-08-05T10:08:46.711Z,"urn:li:comment:(activity:7357997583023165440,7358438815134306307)",f0b18af3ed27da1243bbc8b7d777a3fe822a8fca91dc859dc06cd44e6745ee6c,urn:li:activity:7357997583023165440,667607e8d223e803437f400ae71762a50896361437d6b7a65642953020b75006
Ashish Francis,https://www.linkedin.com/in/francis-ashish,Leveraging Data and Bridging Customer Needs with Scalable Solutions | Driving Product Adoption and end-to-end lifecycle Management | Client Growth with Data Analysis and ML | Customer Success | B2B SaaS | Agent AI | LLMS,In the end the decision of an average Protein consumer depends on the fact if it’s digested well 🤣,2025-08-05T09:46:02.375Z,"urn:li:comment:(activity:7357997583023165440,7358433092694405124)",351e7ba10adff2db0617098ec1ddf22f238423d750b4ee72d423bb11608330a3,urn:li:activity:7357997583023165440,667607e8d223e803437f400ae71762a50896361437d6b7a65642953020b75006
Ashish Francis,https://www.linkedin.com/in/francis-ashish,Leveraging Data and Bridging Customer Needs with Scalable Solutions | Driving Product Adoption and end-to-end lifecycle Management | Client Growth with Data Analysis and ML | Customer Success | B2B SaaS | Agent AI | LLMS,In the end the decision of an average Protein consumer depends on the fact if it’s digested well 🤣,2025-08-05T09:45:54.540Z,"urn:li:comment:(activity:7357997583023165440,7358433059832057857)",4f2f78001ca0c953e32d427683196dbc07cf637b8ff3729562fdf3c2c7ebb578,urn:li:activity:7357997583023165440,667607e8d223e803437f400ae71762a50896361437d6b7a65642953020b75006
Gargi Singh ᴾᵃᶜᵏᵗᵒᵒⁿ🫧,https://www.linkedin.com/in/gargi-singh-branddesigner,I help CPG's Sell through Packaging+Brand Design,PROTEIN MADNESS its now in every product 🤣 ,2025-08-05T09:20:43.048Z,"urn:li:comment:(activity:7357997583023165440,7358426720175099904)",48010111f5762dfb76a94afdba5c942bb5d9dab5a02df2b4df06c9a73b6190b7,urn:li:activity:7357997583023165440,667607e8d223e803437f400ae71762a50896361437d6b7a65642953020b75006
Mayank Gupta,https://www.linkedin.com/in/guptamayank,"Co-Founder, Zopper","Of late, we are also eating chocolate wafers and chips by justifying them as protein!",2025-08-05T07:19:55.554Z,"urn:li:comment:(activity:7357997583023165440,7358396321982042113)",8f220fa0eeda7adb3913dce8ece2bd50ed2d5753198e648a137aa0e1251ac722,urn:li:activity:7357997583023165440,667607e8d223e803437f400ae71762a50896361437d6b7a65642953020b75006
Apoorva Bagchi,https://www.linkedin.com/in/apoorvabagchi,Partnering with visionary institutions to build the future of Indian education at Jetri (formerly 9.9 Education),"It’s the industry building this up: exactly what they do with the oils, butter and ghee.",2025-08-05T06:34:42.599Z,"urn:li:comment:(activity:7357997583023165440,7358384943024037888)",20325f6458d8ad1f720fc5ee2e8de7c26f938d09299c9e6e9a8a84f106f24da2,urn:li:activity:7357997583023165440,667607e8d223e803437f400ae71762a50896361437d6b7a65642953020b75006
Saurabh Agarwal,https://www.linkedin.com/in/saurabhagarwal-growit,Founder & CEO @ GROWiT - Empowering Farmers for Food Security towards a Sustainable Future. TEDx Speaker,"Ha, sometimes it feels like protein will soon have its own festival.",2025-08-05T04:57:32.186Z,"urn:li:comment:(activity:7357997583023165440,7358360488499474432)",9bcdc5e6dcef5471630d96845d100f6b36cf7bffc05df18bac9642144764d9d4,urn:li:activity:7357997583023165440,667607e8d223e803437f400ae71762a50896361437d6b7a65642953020b75006
Yash Laddha,https://www.linkedin.com/in/yash-laddha-laddhagroup,Business Development at Laddha Group of Industries || Co-Founder at PetWagon,"The protein market is indeed overflowing, and it's crucial for consumers to make informed choices rather than getting caught up in the hype. Quality over quantity should always be the mantra for nutrition.",2025-08-05T04:03:52.789Z,"urn:li:comment:(activity:7357997583023165440,7358346985369694208)",7acfbbd55498ea57ef1bf19365555b2e48ca5fff192ab09436f94e59873a1e5f,urn:li:activity:7357997583023165440,667607e8d223e803437f400ae71762a50896361437d6b7a65642953020b75006
Sonal Snehal Shah,https://www.linkedin.com/in/sonalsnehalshah,The Mom Who Turns Life Into Lines | Ghostwriter l Social Media Strategist / Podcast Host & Producer | Voice Translation & Dubbing Enthusiast Recorded 5 Podcast / with 1.5 lacs downloads / 57 countries.,"Haha, true! 😅 But I always believe in Eat smart, not just because it's “clinically backed.”",2025-08-05T04:02:37.280Z,"urn:li:comment:(activity:7357997583023165440,7358346668666253312)",562d9ff238e69d2d879f4cd348b2966bb92da1c18255f9c879c4650fa8c28391,urn:li:activity:7357997583023165440,667607e8d223e803437f400ae71762a50896361437d6b7a65642953020b75006
CA Pavan Joshi,https://www.linkedin.com/in/capavanjoshi,GST & Income Tax Expert | FCA | DISA | Senior Partner at P N JOSHI & CO | Zoho Partner | Helping Businesses Stay Compliant & Grow,"The protein gold rush is real—but amidst all the branding noise, purpose-driven nutrition should still lead the way.",2025-08-04T16:44:44.365Z,"urn:li:comment:(activity:7357997583023165440,7358176074091945985)",70c2497cb5519946018a6adc33ceee6d3d59364662981370cac39d0d21d8412e,urn:li:activity:7357997583023165440,667607e8d223e803437f400ae71762a50896361437d6b7a65642953020b75006
Dhruv Bhatia,https://www.linkedin.com/in/dhruvbhatia,Senior Product Manager | AI & Agent-Driven Solutions | 2x Founder,If the founder of a protein brand doesn't have the right muscle definition I'm not buying the brand 😅,2025-08-04T15:53:07.093Z,"urn:li:comment:(activity:7357997583023165440,7358163083195748352)",001ae12f26dc2b9e02db8b9f5c092335aa21b4fb48cc19d916810b27b7014285,urn:li:activity:7357997583023165440,667607e8d223e803437f400ae71762a50896361437d6b7a65642953020b75006
Sunandini Bose,https://www.linkedin.com/in/subo1707,Work Food- Food Tech | How Not To Die,"I like the influence. 
It’s comical to see how some corporates are really putting an effort for high protein intake. And Employees willingly or unwillingly are consuming it.

But on the other side, some people are least bothered. They want the full feel of Fun, and Attractive Food to call in their Employees to WFO. Dilip Kumar",2025-08-04T15:25:13.820Z,"urn:li:comment:(activity:7357997583023165440,7358156064975998977)",45fa06ab68b94ab1c33b3d9db427e5db2d87b250cfd455d8dfdd758df15ddd5d,urn:li:activity:7357997583023165440,667607e8d223e803437f400ae71762a50896361437d6b7a65642953020b75006
Saloni Pravindra,https://www.linkedin.com/in/saloni-pravindra-80368748,Building DEHI | Ex Blinkit & Shiprocket | Esade | LSE,There's protein in Kulfi too!,2025-08-04T14:55:44.197Z,"urn:li:comment:(activity:7357997583023165440,7358148642643365890)",1765be7e5be96bee70f6a9002a5d16532912cb875c58caffc85e9ebbf0d15363,urn:li:activity:7357997583023165440,667607e8d223e803437f400ae71762a50896361437d6b7a65642953020b75006
Bency Sebastian,https://www.linkedin.com/in/bency-sebastian-marketing,"I help brands grow via story-led, data-driven content | Brand Strategist, Content Marketer & Social Media Manager",Everything now is a high protein recipe or a high protein snack 😂 ,2025-08-04T14:48:49.268Z,"urn:li:comment:(activity:7357997583023165440,7358146902300790785)",b90dd796b77a858d2494aee5d73d9b03b19a9c43590fa1acdb80ee043e954967,urn:li:activity:7357997583023165440,667607e8d223e803437f400ae71762a50896361437d6b7a65642953020b75006
Marathon Coach 2020,,442 followers,"Ever wonder when the best three sources of proteins are simple home-grown things - 1)Buttermilk, 2)Paneer (cottage cheese) & 3)Eggs…….why would one need a Protein powder/supplement, Dilip?",2025-08-04T14:22:18.220Z,"urn:li:comment:(activity:7357997583023165440,7358140228965945346)",3e5207db8d35d6254ba53566baa1a69d5c3c7c9416ca5901490e7ee2bf3006ad,urn:li:activity:7357997583023165440,667607e8d223e803437f400ae71762a50896361437d6b7a65642953020b75006
Rohit Sharan,https://www.linkedin.com/in/rohitsharan2008,Senior Manager Artificial Intelligence (AI) Strategy Building for iGaming Industry | MSc Artificial Intelligence (AI) | PyPI contributor | Ex PwC | Pursuing MSc (Online) Criminology and Criminal Psychology,Just like there are more startup founders than employees on LinkedIn nowadays,2025-08-04T14:16:19.206Z,"urn:li:comment:(activity:7357997583023165440,7358138723147964420)",adbcd4fd043dd49b15e73d0711ca4daa7eb301af0d7d8a0ad0f04506ef8b4e21,urn:li:activity:7357997583023165440,667607e8d223e803437f400ae71762a50896361437d6b7a65642953020b75006
Sulakshana C Chitale,https://www.linkedin.com/in/sulakshana-c-chitale-a4672b19,Building GoSwasthya | Redefining health in traditional way | Private Equity Professional | IIM Bangalore | GS10K | NSRCL | Google Startup | 91Springboard Level Up,"I agree 💯. One formula fits all cannot be the case. There was a time when I started having protein powder of a very clean brand but ironically I started getting rashes when I consumed seafood which I have been eating since childhood and so I realised even though the product was good, my body is getting accustomed to it and rejecting something which I have been having for years now. So I stopped and It was normal. So consuming what fits you as an individual and analysing what traditionally we consumed helps for our gut health",2025-08-04T14:13:22.951Z,"urn:li:comment:(activity:7357997583023165440,7358137983880876033)",dc08e4c1064a9a259da497ea9c49224ed6f4a861d603e0ff81bef37463ab834c,urn:li:activity:7357997583023165440,667607e8d223e803437f400ae71762a50896361437d6b7a65642953020b75006
Afzal Latif,https://www.linkedin.com/in/afzalatif2828,Founder - AL PROTEINS + Gr8 Foodz,"Dilip Kumar 

Very well said .

Natural Proteins like Meat etc are sold in an unhygienic manner - except for few exceptions ...

While everyone wants to climb the Protein bandwagon which they think is an "" investors magnet ""

Ultimately natural Proteins has to evolve and become a hygienic option with convenience and affordability.",2025-08-04T14:07:58.121Z,"urn:li:comment:(activity:7357997583023165440,7358136621449330688)",d980ddfccb3457f677b906e03422f23fc5c25a35166646f2c58e8decb65ce259,urn:li:activity:7357997583023165440,667607e8d223e803437f400ae71762a50896361437d6b7a65642953020b75006
Srijan Jain,https://www.linkedin.com/in/srijanjain,Founder @Dexy - AI SDR + Full Outbound Stack = Qualified meetings on your calendar,"Building in this space? Purpose > posturing.

The volume of ""doctor-backed"" supplements right now feels less like science, more like storytelling. Dilip Kumar 
",2025-08-04T13:50:51.705Z,"urn:li:comment:(activity:7357997583023165440,7358132316348559361)",3b130cea77f544ac6ae52863e97c8c6f652a8fcf537d0f855a092192b38799e6,urn:li:activity:7357997583023165440,667607e8d223e803437f400ae71762a50896361437d6b7a65642953020b75006
Rohit Kukreja,https://www.linkedin.com/in/rohit-kukreja-547658146,"Fitness Entrepreneur | Sales, Strategy, IP, Podcast","Agreed ,  wherever you go there is a new protein brand , even hydration brands . But as a founder there is still space for a lot of innovation in the protein category . What everyone is really doing is "" copying "" each other . INNOVATION is still lacking",2025-08-04T13:46:32.484Z,"urn:li:comment:(activity:7357997583023165440,7358131229092646912)",6ad9cdd2447fc885c6392d26e5864829731a24450ba13e18d6e097849fbe35e5,urn:li:activity:7357997583023165440,667607e8d223e803437f400ae71762a50896361437d6b7a65642953020b75006
Payal A Kumar,https://www.linkedin.com/in/payal-a-kumar,Strategist for Sustainable brands I Branding I Marketing I Foresight I Founder @The Nex Era Collective,Agree BUT the storytelling lacks luster here to change the narrative. Curious what ideas do you have to shift consumer behaviour?,2025-08-04T13:32:07.304Z,"urn:li:comment:(activity:7357997583023165440,7358127600264753152)",2840b2dddcf47ade66d1381e28bcd5f5c8c9db8131cf08ba2ded0512de0bb9fa,urn:li:activity:7357997583023165440,667607e8d223e803437f400ae71762a50896361437d6b7a65642953020b75006
Swapnil S Wilson,https://www.linkedin.com/in/swapnilwil,Decoding Marketing Campaigns| Brand Management Intern | Sales-Driven |,Meanwhile carbs are being treated as a middle child .,2025-08-04T13:24:45.775Z,"urn:li:comment:(activity:7357997583023165440,7358125748357849092)",9a53909ae28cfbc962d2d252214a1f81e9d7d8bac09f6d50ab0df685533d0f1d,urn:li:activity:7357997583023165440,667607e8d223e803437f400ae71762a50896361437d6b7a65642953020b75006
Sri Lasya Gade,https://www.linkedin.com/in/srilasyagade,FP&A at Masdar STS | Strategic Finance |UAE | Renewables | Ex- KPMG | Ex-Aranca | Ex-SquareYards | Ex-Genpact | IMT - G alum | 12 years in Finance,"And plant based, gut friendly!",2025-08-04T13:14:38.628Z,"urn:li:comment:(activity:7357997583023165440,7358123201798828034)",04f91e5d3fc033af2953ce3f25cbd4325777215cbb7a517a068f555158956309,urn:li:activity:7357997583023165440,667607e8d223e803437f400ae71762a50896361437d6b7a65642953020b75006
Bugata Sai Swaroop,https://www.linkedin.com/in/bugata-sai-swaroop,Growth & Product Manager | Paytm,Trend chasing is trending,2025-08-04T12:57:59.180Z,"urn:li:comment:(activity:7357997583023165440,7358119009810051072)",db60f3b75eac4d1765a84998b36d9ba6aaaacc9f23b164d43f2d4778ba87e6c8,urn:li:activity:7357997583023165440,667607e8d223e803437f400ae71762a50896361437d6b7a65642953020b75006
Jyotsna Chauhan,https://www.linkedin.com/in/jyotsna-chauhan-63b6572a,Founder Belloroma | 25 Years of Expertise in Crafting Perfumes,All whey protein is imported from outside . We donoy know what is inside it.   I think new brand should be on on Befallo A2 whey protein.,2025-08-04T12:44:00.294Z,"urn:li:comment:(activity:7357997583023165440,7358115491271397376)",df09fffab2666a6cd77cde704dae35a62056495cccee27808f6f31a250a5e392,urn:li:activity:7357997583023165440,667607e8d223e803437f400ae71762a50896361437d6b7a65642953020b75006
Amar Haksar,https://www.linkedin.com/in/amarhaksar,"Master Mindset & Performance Coach/Motivational Speaker/Fitness+Life+Executive Coach/Endurance Enthusiast. 1st Indian to cycle 5,700kms sole/unsupported across USA & 1,500+ consecutive day triathlon activity streak.","The obsession with “supplements” feels like an escape from the work Dilip Kumar 

The new age of fitness seems to be focused on supplements and equipment i.e. rings, watches, patches, etc etc.

No judgment on any of the above…all are good, once you have started to do the work…but, there’s no way around the actual WORK!

To put in the kind of work required for long term CONSISTENCY, one has to start with developing a stronger MINDSET.

And that, my friends, cannot be measured by rings or built on supplements.

In some cases, even the diet-fad is a cop out…easier to “cut” calories than to burn “calories.”

A couch potato on a healthy diet is still a couch potato 😀

Of course, it’s a “business” thing as well…easier to create a business around selling a physical product (supplements, measuring gadgets) than something intangible - MINDSET!

The “business” potential of MINDSET growth is still (relatively) untapped in India…mainly because the focus is still on visual aesthetics (6-pack, biceps, etc).

It’s an outstanding opportunity that would only enhance the sales of physical products…and, thankfully, it is starting to happen.",2025-08-04T12:15:25.112Z,"urn:li:comment:(activity:7357997583023165440,7358108297272393728)",052b12b47b2dfe13affee5582579c42770ed973ff36058af166fea10a0d35b64,urn:li:activity:7357997583023165440,667607e8d223e803437f400ae71762a50896361437d6b7a65642953020b75006
Shiv Kumar Pandey,https://www.linkedin.com/in/shivpandey,"HR Services Marketing Expert | Founder & CEO, Niumatrix Digital","Smart take—and much needed. The protein wave feels more like a marketing marathon than a health movement. Purpose > packaging, always.",2025-08-04T12:00:32.532Z,"urn:li:comment:(activity:7357997583023165440,7358104553520582657)",0881c224103831acbafbfa1ebcaf4f9f51143e66bf95f21580e8c25ef700cda6,urn:li:activity:7357997583023165440,667607e8d223e803437f400ae71762a50896361437d6b7a65642953020b75006
