author.headline,author.profile_url,author.username,full_urn,post_type,posted_at.date,posted_at.timestamp,stats.celebrate,stats.comments,stats.funny,stats.insight,stats.like,stats.love,stats.reposts,stats.support,stats.total_reactions,text,url,author.full_name
Entrepreneur| Investments at Rainmatter | Endurance athlete,https://www.linkedin.com/in/dilipevs?miniProfileUrn=urn%3Ali%3Afsd_profile%3AACoAAABll5IBLSjIvTtdv-7G24ZqrORIfrfIaTY,dilipevs,urn:li:activity:7402578320082796544,regular,2025-12-05 06:23:24,1764912204762,26,35,0,7,821,45,7,12,911,Had shared this few months back. Update on this- we are investing in Praan Health and supporting Navneeth to solve for elder care in India. Massive opportunity that needs patient capital.,https://www.linkedin.com/posts/dilipevs_had-shared-this-few-months-back-update-on-activity-7402578320082796544-I_Bn?utm_source=social_share_send&utm_medium=member_desktop_web&rcm=ACoAAGCAEu0BbKiDpa8cqr7EW4NkR5exUjrsREo,Dilip Kumar
Entrepreneur| Investments at Rainmatter | Endurance athlete,https://www.linkedin.com/in/dilipevs?miniProfileUrn=urn%3Ali%3Afsd_profile%3AACoAAABll5IBLSjIvTtdv-7G24ZqrORIfrfIaTY,dilipevs,urn:li:activity:7401119303774793728,regular,2025-12-01 05:45:48,1764564348167,20,136,2,16,2012,214,69,93,2357,"Everyone is experiencing brain fog. Including you. Stop scrolling, stop watching stupid reels, unfollow the nonsense, get out of the rubbish whatsapp groups, keep your phone away for atleast few hours a day, make something you’re proud of, help people without them asking, stop wasting time on gossip & outrage, choose what actually matters, protect your time, invest in your health, create more than you consume. Read a book. Save yourself.",https://www.linkedin.com/posts/dilipevs_everyone-is-experiencing-brain-fog-including-activity-7401119303774793728-sX8F?utm_source=social_share_send&utm_medium=member_desktop_web&rcm=ACoAAGCAEu0BbKiDpa8cqr7EW4NkR5exUjrsREo,Dilip Kumar
Entrepreneur| Investments at Rainmatter | Endurance athlete,https://www.linkedin.com/in/dilipevs?miniProfileUrn=urn%3Ali%3Afsd_profile%3AACoAAABll5IBLSjIvTtdv-7G24ZqrORIfrfIaTY,dilipevs,urn:li:activity:7396777492012945408,regular,2025-11-19 06:12:59,1763529179576,1,56,0,26,419,31,4,3,480,"Amul has evolved from a dairy to a nutrition brand and is probably the most underrated case study in modern day business. They did a revenue of 90,000cr in FY25. Hard to think of another company in the world that has done something similar. Notes on what i think they got right..

1) They innovate at cooperative speed not startup speed and still wins. Launched 250 product launches in 5 years and that's crazy speed for a cooperative with millions of farmers, 18000+ village societies, and government-linked processes. Most companies will shiver at this speed.

2) They turned cold chain into a moat decades before most startups spoke about supply chain tech. They run India’s largest cold supply chain with refrigeration networks across rural area and temperature controlled logistics in small towns. This single capability lets them enter any nutrition category quickly.

3) The nutrition transition feels like farmer driven. More milk production means surplus fat & SNF (casien, whey , lactose) and therefore opportunity to create value added products. Every new category like whey, chocolates, drinks, cheese, creates more value for farmers. Most nutrition brands optimise for margins but they optimise for farmer income.

4) Amul is probably the only brand that simultaneously sells mass and premium products all under same brand,  same dairy and distribution and with same trust. Their products range for Rs 5 to 500. Most brands split into sub brands while Amul let the trust carry everything.

No obsession with burn, CAC ,CM1/2 growth and branding. They quietly proved that trust, scale and farmer first thinking can still beat everyone.",https://www.linkedin.com/posts/dilipevs_amul-has-evolved-from-a-dairy-to-a-nutrition-activity-7396777492012945408-sVKw?utm_source=social_share_send&utm_medium=member_desktop_web&rcm=ACoAAGCAEu0BbKiDpa8cqr7EW4NkR5exUjrsREo,Dilip Kumar
Entrepreneur| Investments at Rainmatter | Endurance athlete,https://www.linkedin.com/in/dilipevs?miniProfileUrn=urn%3Ali%3Afsd_profile%3AACoAAABll5IBLSjIvTtdv-7G24ZqrORIfrfIaTY,dilipevs,urn:li:activity:7394638641383452672,regular,2025-11-13 08:33:57,1763019237848,0,47,0,1,357,26,12,28,412,"15–20% of medicines in India are fake or substandard. Pharma is a $58Billion market. This is not fear mongering but a reminder that your health shouldn’t rely on what comes in tablets. 

Prevention is still the cheapest, safest, and most authentic form of healthcare.

Move daily. Eat clean.Sleep well. Manage stress. Get regular blood work.

Build a life where you don’t need medicines often.",https://www.linkedin.com/posts/dilipevs_1520-of-medicines-in-india-are-fake-or-activity-7394638641383452672-qNyS?utm_source=social_share_send&utm_medium=member_desktop_web&rcm=ACoAAGCAEu0BbKiDpa8cqr7EW4NkR5exUjrsREo,Dilip Kumar
Entrepreneur| Investments at Rainmatter | Endurance athlete,https://www.linkedin.com/in/dilipevs?miniProfileUrn=urn%3Ali%3Afsd_profile%3AACoAAABll5IBLSjIvTtdv-7G24ZqrORIfrfIaTY,dilipevs,urn:li:activity:7389586926720344066,regular,2025-10-30 10:00:15,1761814815216,2,16,0,9,332,36,3,2,381,Boss had sent this internal message a few days back. Take a print and frame it.,https://www.linkedin.com/posts/dilipevs_boss-had-sent-this-internal-message-a-few-activity-7389586926720344066-iVlp?utm_source=social_share_send&utm_medium=member_desktop_web&rcm=ACoAAGCAEu0BbKiDpa8cqr7EW4NkR5exUjrsREo,Dilip Kumar
Entrepreneur| Investments at Rainmatter | Endurance athlete,https://www.linkedin.com/in/dilipevs?miniProfileUrn=urn%3Ali%3Afsd_profile%3AACoAAABll5IBLSjIvTtdv-7G24ZqrORIfrfIaTY,dilipevs,urn:li:activity:7375035321044049920,regular,2025-09-20 07:17:22,1758345442067,22,107,1,20,1795,144,31,96,2078,"America just put a $100,000 price tag on the Indian dream. Never been a better time than now for Indian engineers to build at home. The US was the promised land for Indian engineers but not anymore. And India isn’t the India of the 90s when engineers moved out for better pay and exposure. 

Earlier generations left India because they didn’t have a choice. Today, staying back is the smarter choice. The US is telling the world that they want fewer immigrants, at higher prices & under tighter conditions. 

In the 1960s & 70s, US actively recruited Indian doctors and engineers to fill shortages. In the 90s & 2000s, IT/software outsourcing made H-1B the obvious path for thousands of engineers. In reality, the India of today is not the India many left behind. 

This is not to say India is without its own constraints. We still have infrastructure gaps and bureaucracy is still frustrating.
But if you look back at history, Indian engineers have always thrived precisely in moments of constraint. 

The outsourcing opportunity of the 90s was born from wage arbitrage. The SaaS opportunity of the 2010s came from building global software with frugal & distributed teams. Each cycle has taken adversity and Indian entrepreneurs turned it into advantage.

The next cycle will be no different. The very inefficiencies of India around fragmented supply chains, healthcare gaps, broken education models will be the anchor to build world class companies. To solve for India is to solve for the future of other emerging markets.

This is the great inversion of our time and for the first time in history, the opportunity cost of leaving India may be greater than the opportunity cost of staying.

The last generation of Indian engineers built America’s tech backbone. The next generation has the chance to build India’s. Come back home. Time to build for India and from India.",https://www.linkedin.com/posts/dilipevs_america-just-put-a-100000-price-tag-on-activity-7375035321044049920-Is9K?utm_source=social_share_send&utm_medium=member_desktop_web&rcm=ACoAAGCAEu0BbKiDpa8cqr7EW4NkR5exUjrsREo,Dilip Kumar
Entrepreneur| Investments at Rainmatter | Endurance athlete,https://www.linkedin.com/in/dilipevs?miniProfileUrn=urn%3Ali%3Afsd_profile%3AACoAAABll5IBLSjIvTtdv-7G24ZqrORIfrfIaTY,dilipevs,urn:li:activity:7368508498621431810,regular,2025-09-02 07:02:06,1756789326339,158,558,0,5,3002,344,8,76,3585,"Call me crazy but, I’m on a mission to create a community of 100 founders in India by end of this year who lift weights & runs a few days a week. Will never compromise on sleep and family time. And takes pride in being a happy & satisfied entrepreneur. Nothing else matters.",https://www.linkedin.com/posts/dilipevs_call-me-crazy-but-im-on-a-mission-to-create-activity-7368508498621431810-vaJg?utm_source=social_share_send&utm_medium=member_desktop_web&rcm=ACoAAGCAEu0BbKiDpa8cqr7EW4NkR5exUjrsREo,Dilip Kumar
Entrepreneur| Investments at Rainmatter | Endurance athlete,https://www.linkedin.com/in/dilipevs?miniProfileUrn=urn%3Ali%3Afsd_profile%3AACoAAABll5IBLSjIvTtdv-7G24ZqrORIfrfIaTY,dilipevs,urn:li:activity:7365618821707071488,regular,2025-08-25 07:39:33,1756100373675,8,267,2,5,639,32,5,36,722,"Every day I see posts about why people want to leave India. India isn’t perfect, but no country is. I think before self driving cars or AI chips, we first need to improve quality of life here. 

Imagine if more of us built tools for public good in health & climate that make daily life better. Rainmatter/Zerodha will back and build this together.

What’s one problem you face daily that you wish had a simple solution?",https://www.linkedin.com/posts/dilipevs_every-day-i-see-posts-about-why-people-want-activity-7365618821707071488-I7jd?utm_source=social_share_send&utm_medium=member_desktop_web&rcm=ACoAAGCAEu0BbKiDpa8cqr7EW4NkR5exUjrsREo,Dilip Kumar
Entrepreneur| Investments at Rainmatter | Endurance athlete,https://www.linkedin.com/in/dilipevs?miniProfileUrn=urn%3Ali%3Afsd_profile%3AACoAAABll5IBLSjIvTtdv-7G24ZqrORIfrfIaTY,dilipevs,urn:li:activity:7363088962380328961,regular,2025-08-18 08:06:48,1755497208209,58,32,1,5,1017,106,3,9,1196,15months back i told a founder to not raise VC money. Yesterday he emailed me saying they’re profitable and on track to do $2M. Sharing this here as a reminder that not every founder needs an investor. Some just need to hear the truth and have the belief. Be like Sid!,https://www.linkedin.com/posts/dilipevs_15months-back-i-told-a-founder-to-not-raise-activity-7363088962380328961-W2kv?utm_source=social_share_send&utm_medium=member_desktop_web&rcm=ACoAAGCAEu0BbKiDpa8cqr7EW4NkR5exUjrsREo,Dilip Kumar
Entrepreneur| Investments at Rainmatter | Endurance athlete,https://www.linkedin.com/in/dilipevs?miniProfileUrn=urn%3Ali%3Afsd_profile%3AACoAAABll5IBLSjIvTtdv-7G24ZqrORIfrfIaTY,dilipevs,urn:li:activity:7360538503241195521,regular,2025-08-11 07:12:11,1754889131365,6,97,1,3,413,14,4,6,443,"At Rainmatter-Zerodha, we’re keen to meet people building or passionate about Deeptech in India. The last 15 yrs were consumer apps. The next wave is Deeptech moats. If we don’t build this now, we’ll be depending on others for what matters most. 

Who should we talk and learn from?",https://www.linkedin.com/posts/dilipevs_at-rainmatter-zerodha-were-keen-to-meet-activity-7360538503241195521-NJ2h?utm_source=social_share_send&utm_medium=member_desktop_web&rcm=ACoAAGCAEu0BbKiDpa8cqr7EW4NkR5exUjrsREo,Dilip Kumar
Entrepreneur| Investments at Rainmatter | Endurance athlete,https://www.linkedin.com/in/dilipevs?miniProfileUrn=urn%3Ali%3Afsd_profile%3AACoAAABll5IBLSjIvTtdv-7G24ZqrORIfrfIaTY,dilipevs,urn:li:activity:7357997583023165440,regular,2025-08-04 06:55:28,1754283328777,0,162,242,5,780,8,5,14,1049,"At this point i feel there are more protein brands than protein consumers 😅

Every protein brand is now- Lab tested, doctor recommended & clinically backed.

By 2026, every Indian will either launch a protein powder or be in one 😀

As a consumer, sure eat appropriate protein. But do it with purpose, not propaganda. Nutrition isn’t about being part of a trend.",https://www.linkedin.com/posts/dilipevs_at-this-point-i-feel-there-are-more-protein-activity-7357997583023165440-AKTe?utm_source=social_share_send&utm_medium=member_desktop_web&rcm=ACoAAGCAEu0BbKiDpa8cqr7EW4NkR5exUjrsREo,Dilip Kumar
Entrepreneur| Investments at Rainmatter | Endurance athlete,https://www.linkedin.com/in/dilipevs?miniProfileUrn=urn%3Ali%3Afsd_profile%3AACoAAABll5IBLSjIvTtdv-7G24ZqrORIfrfIaTY,dilipevs,urn:li:activity:7352599276381753345,regular,2025-07-20 09:24:32,1752996272178,43,952,0,1,1311,96,14,8,1459,"Founders Peak by Rainmatter- Zerodha. 
60+ founders met for 2hrs today morning doing just one thing- working on their physical and mental fitness. No pitch decks. No filters. Just founders, showing up.

This isn’t just for our portfolio. It’s for every founder in India-whether you’re funded by us, by someone else, or by no one at all. You just have to show up. 

We are coming to Gurgaon (July 26th) & Mumbai (August 2nd). 

Comment below if you want to join and you’ll get an invite link.",https://www.linkedin.com/posts/dilipevs_founders-peak-by-rainmatter-zerodha-60-activity-7352599276381753345-6XNj?utm_source=social_share_send&utm_medium=member_desktop_web&rcm=ACoAAGCAEu0BbKiDpa8cqr7EW4NkR5exUjrsREo,Dilip Kumar
Entrepreneur| Investments at Rainmatter | Endurance athlete,https://www.linkedin.com/in/dilipevs?miniProfileUrn=urn%3Ali%3Afsd_profile%3AACoAAABll5IBLSjIvTtdv-7G24ZqrORIfrfIaTY,dilipevs,urn:li:activity:7351838960739905536,regular,2025-07-18 07:03:18,1752814998803,3,189,0,62,941,52,15,31,1089,"Every week, I get a 10 new startup pitches that says “We’ll deliver healthcare in 10 minutes.” Quick commerce is now rushing into healthcare. So I thought to do a breakdown on what’s hype and what might actually work in India. 

What could work?
1)30–60 min medicine delivery can work for chronic refills or acute needs. In metros with dense demand, it's useful. But 10-min isn’t necessary. Even same-day is fine for 90% of use cases. And honestly, your local chemist is already doing that.

2) Rapid diagnostics for home blood collection isn’t about speed but it’s about hygiene and reliability. A 2-hour sample pickup and next-morning results is a solid win. What we need is better logistics and trained phlebotomists, not faster scooters.

3)On-demand nursing or paramedic visits but for use cases like wound care, IV, injections. Could work with proper scheduling. Think “Ola for nurses,” not “Blinkit for bandages.” Needs backend infra for verification, training, EMR integration.

What won’t work (At least not now)
1) Ambulance in 10 mins sounds great until you hit Delhi or Bangalore traffic. Speed is useless without triage and location accuracy. What we really need is better coordination between hospitals and ambulance providers, not just faster wheels.

2) On-demand doctors in 10 mins is a bad idea. You don’t need any doctor fast but you need the right one. Discovery & matching are bigger problems than speed. Most video consults struggle with quality, not timing. Clinical care isn’t fast food. Trust takes time.

3) The 10-min everything app for healthcare is lazy ambition dressed up with VC money. Healthcare isn’t a SKU game but it’s complex, regulated, and hard to standardize like groceries. Great for funding buzz, terrible for trust and real outcomes.

Few thoughts if you really are passionate to build in healthcare. 
Trust > velocity.
Speed isn’t everything.
Infra & people ops > APIs.
Reliability > 10-min hacks.
Health is longitudinal & not transactional.

Good luck if you're building something in Healthcare in India.",https://www.linkedin.com/posts/dilipevs_every-week-i-get-a-10-new-startup-pitches-activity-7351838960739905536-0_m4?utm_source=social_share_send&utm_medium=member_desktop_web&rcm=ACoAAGCAEu0BbKiDpa8cqr7EW4NkR5exUjrsREo,Dilip Kumar
Entrepreneur| Investments at Rainmatter | Endurance athlete,https://www.linkedin.com/in/dilipevs?miniProfileUrn=urn%3Ali%3Afsd_profile%3AACoAAABll5IBLSjIvTtdv-7G24ZqrORIfrfIaTY,dilipevs,urn:li:ugcPost:7350035959809253376,regular,2025-07-13 07:41:30,1752385290650,23,68,0,2,885,98,8,5,1013,"2020: Sent a cold email to Nithin Kamath and raised capital.
2023: Working alongside him to back other founders.

Built a few startups. Shut some down.
Now backing founders who are braver than I was.
This is usually my answer when someone asks me to introduce myself.

Thanks to the good folks at GrowthX® unbundling some snippets from my past and present. If you're a founder and think I can be of help- just reach out.Always happy to chat.",https://www.linkedin.com/posts/dilipevs_2020-sent-a-cold-email-to-nithin-kamath-activity-7350036634114924544-eG2r?utm_source=social_share_send&utm_medium=member_desktop_web&rcm=ACoAAGCAEu0BbKiDpa8cqr7EW4NkR5exUjrsREo,Dilip Kumar
Entrepreneur| Investments at Rainmatter | Endurance athlete,https://www.linkedin.com/in/dilipevs?miniProfileUrn=urn%3Ali%3Afsd_profile%3AACoAAABll5IBLSjIvTtdv-7G24ZqrORIfrfIaTY,dilipevs,urn:li:activity:7348579224074539008,regular,2025-07-09 07:10:17,1752037817019,2,138,0,34,567,13,5,82,698,"Got a message yesterday from a friend that they lost their 7 day old baby last week. Got me thinking why this happens and turns out, it’s not uncommon.

India’s infant mortality rate is about 25 per 1,000 births. That’s 2.5% of infants who don’t survive. The sad part is that nearly 60% of these deaths are preventable with better care. 

This is where I believe AI in healthcare can truly make a difference. 
We can develop predictive models for at-risk pregnancies using maternal health data. Build remote monitoring systems that flag early signs of preterm labor. Even use image based diagnostics to catch neonatal infections before they turn fatal.

I hope more people building for healthcare in India focus on solutions that can detect risks early and save lives. No parent should lose a child to something we could’ve seen coming.",https://www.linkedin.com/posts/dilipevs_got-a-message-yesterday-from-a-friend-that-activity-7348579224074539008-ck2J?utm_source=social_share_send&utm_medium=member_desktop_web&rcm=ACoAAGCAEu0BbKiDpa8cqr7EW4NkR5exUjrsREo,Dilip Kumar
Entrepreneur| Investments at Rainmatter | Endurance athlete,https://www.linkedin.com/in/dilipevs?miniProfileUrn=urn%3Ali%3Afsd_profile%3AACoAAABll5IBLSjIvTtdv-7G24ZqrORIfrfIaTY,dilipevs,urn:li:ugcPost:7347494832988135426,regular,2025-07-06 07:21:18,1751779278252,43,296,0,1,1089,93,15,11,1237,"Founders Peak by Rainmatter-Zerodha is live. Yesterday, 40+ founders came together to invest in something even more valuable than startup funding-their own mental, physical & emotional health. 

A random idea i posted online two weeks ago now has a shape & energy. I'll say it again- a founder’s health is the real moat of the business.

This isn’t just for our portfolio. It’s for every founder in India-whether you’re funded by us, by someone else, or by no one at all. No pitch decks. No filters. You just have to show up.

Why are we doing this? Because everyone talks about product market fit. But no one tells the founder: You are the most valuable IP in the company. Don’t burn out.

Which city should we do next? Drop your name, and we’ll send you an invite. 
Lets build this peak. See you soon!",https://www.linkedin.com/posts/dilipevs_founders-peak-by-rainmatter-zerodha-is-live-activity-7347494833889976320-yASm?utm_source=social_share_send&utm_medium=member_desktop_web&rcm=ACoAAGCAEu0BbKiDpa8cqr7EW4NkR5exUjrsREo,Dilip Kumar
Entrepreneur| Investments at Rainmatter | Endurance athlete,https://www.linkedin.com/in/dilipevs?miniProfileUrn=urn%3Ali%3Afsd_profile%3AACoAAABll5IBLSjIvTtdv-7G24ZqrORIfrfIaTY,dilipevs,urn:li:activity:7346770726890192897,regular,2025-07-04 07:23:57,1751606637690,6,64,0,4,651,38,9,44,743,"Four of the world’s top ten chess players are Indians today. The mainstream media is silent, too busy parading a single sport-you know which one. This is how quiet excellence goes unnoticed while hysteria sells.

That’s why we need more independent voices- be it journalists or everyday citizens.",https://www.linkedin.com/posts/dilipevs_four-of-the-worlds-top-ten-chess-players-activity-7346770726890192897-p-m8?utm_source=social_share_send&utm_medium=member_desktop_web&rcm=ACoAAGCAEu0BbKiDpa8cqr7EW4NkR5exUjrsREo,Dilip Kumar
Entrepreneur| Investments at Rainmatter | Endurance athlete,https://www.linkedin.com/in/dilipevs?miniProfileUrn=urn%3Ali%3Afsd_profile%3AACoAAABll5IBLSjIvTtdv-7G24ZqrORIfrfIaTY,dilipevs,urn:li:activity:7346040644156432386,regular,2025-07-02 07:02:52,1751432572402,5,161,0,64,1024,16,20,68,1177,"Approx 68% of milk sold in India is adulterated. And this is per from government data. It isn’t just diluted with water but often spiked with- Detergent, Urea, Starch and sometimes even paint. We’re talking about the one food almost every household consumes daily, especially children.

We need a simple testing kit that any parent can use at home. 
Someone should build this. Many lives can be saved.",https://www.linkedin.com/posts/dilipevs_approx-68-of-milk-sold-in-india-is-adulterated-activity-7346040644156432386-_41X?utm_source=social_share_send&utm_medium=member_desktop_web&rcm=ACoAAGCAEu0BbKiDpa8cqr7EW4NkR5exUjrsREo,Dilip Kumar
Entrepreneur| Investments at Rainmatter | Endurance athlete,https://www.linkedin.com/in/dilipevs?miniProfileUrn=urn%3Ali%3Afsd_profile%3AACoAAABll5IBLSjIvTtdv-7G24ZqrORIfrfIaTY,dilipevs,urn:li:activity:7337710537067114496,regular,2025-06-09 07:22:00,1749446520106,6,134,2,60,1177,39,44,179,1463,"Doctors in India die earlier than their patients. I know it sounds crude but what it means is Indian doctors have a life expectancy that’s nearly 10 years shorter than the average Indian. And this is reported by Indian Medical Association. 

The primary causes are Cardiovascular disease and infections. Ironically, the very things they work tirelessly to prevent.

Endure 10-12 years of medical education with the only aspiration to save lives but be at the receiving end of stress, anxiety, and long working hours. And be a part of a system that doesn’t give them time to care for their own health. The average Indian doctor clocks 60–80 hours a week and approx 300-400 doctors die by suicide every year. Mostly because of the impossible expectations they carry. It takes 10+ years of study before a doctor sees their first salary.

They’re taught that saving lives is everything. After 10hrs+ of work, you can then go and figure your own personal health & family life. And after all this, they’re now told that AI will make them obsolete. That their jobs will be replaced by software tools because the system is inefficient.

I meet atleast 50 companies a month that pitch AI solutions for healthcare. These tools matter and they can make processes faster and improve accessibility. No doubt Indian healthcare needs better processes and better tech. But what it needs more than anything is empathy.

India’s hospitals are crowded and the health crisis is real. But what’s also been ignored is the mental and physical health of our doctors & medical staff. 

This isn’t a rant against technology, AI or healthcare system. But a reminder to self and maybe a few who are reading this that without empathy and without recognizing the human cost, there will be no healthcare system left.",https://www.linkedin.com/posts/dilipevs_doctors-in-india-die-earlier-than-their-patients-activity-7337710537067114496-FONf?utm_source=social_share_send&utm_medium=member_desktop_web&rcm=ACoAAGCAEu0BbKiDpa8cqr7EW4NkR5exUjrsREo,Dilip Kumar
Entrepreneur| Investments at Rainmatter | Endurance athlete,https://www.linkedin.com/in/dilipevs?miniProfileUrn=urn%3Ali%3Afsd_profile%3AACoAAABll5IBLSjIvTtdv-7G24ZqrORIfrfIaTY,dilipevs,urn:li:activity:7337347483863265280,regular,2025-06-08 07:19:21,1749359961477,8,71,0,6,612,117,11,17,760,"An advice from one entrepreneur to another thinking to become a founder today. Manifest this reality-it’s going to be hard. Harder than you imagine. Blogs and YouTube videos are designed to make you feel good. They’re useful, but they’re mostly made by people who seen some form of success. Don’t start thinking there’s a single linear path. The journey will be be scary and lonely.

Take care of your health, both physical and mental. Walk, run, meditate, lift, cycle, swim. Just do anything. Don’t wait for a crisis. There’s no pivot for your body.

Don’t take your relationships for granted. You think they’ll wait, but they won’t. And they shouldn't.  Everyone has finite time to build a life. You’re not wealthy if you have no one to share it with.

Lastly, don’t chase status. It’s the surest way to damage your joy and clarity. Every mistake is an opportunity to improvise. Get good at being corrected without being offended. The rest will follow if you build from a place of authenticity and love for the craft.",https://www.linkedin.com/posts/dilipevs_an-advice-from-one-entrepreneur-to-another-activity-7337347483863265280-es84?utm_source=social_share_send&utm_medium=member_desktop_web&rcm=ACoAAGCAEu0BbKiDpa8cqr7EW4NkR5exUjrsREo,Dilip Kumar
