author.headline,author.profile_url,author.username,full_urn,post_type,posted_at.date,posted_at.timestamp,stats.celebrate,stats.comments,stats.funny,stats.insight,stats.like,stats.love,stats.reposts,stats.support,stats.total_reactions,text,url,author.full_name
Entrepreneur| Investments at Rainmatter | Endurance athlete,https://www.linkedin.com/in/dilipevs?miniProfileUrn=urn%3Ali%3Afsd_profile%3AACoAAABll5IBLSjIvTtdv-7G24ZqrORIfrfIaTY,dilipevs,urn:li:activity:7253998285718241281,regular,2024-10-21 07:19:24,1729487964086,4,58,0,9,326,32,6,16,387,"Entrepreneurs and builders in healthcare, i've 15 words for you.
Prevent, don’t treat
Engage, don’t shout
Prove, don’t promise
Empower, don’t instruct
Simplify, don’t complicate

Will elaborate- 
Prevent, don’t treat – Focus on preventive care, it’s where the future lies.
Engage, don’t shout – Build meaningful conversations, not just sales 
Empower, don’t instruct – Deliver users with knowledge, not rules or features.
Simplify, don’t complicate- Make staying health easy, not overwhelming.
Prove, don’t promise – Focus on showing validation to your claims and not marketing. 

https://x.com/kmr_dilip",https://www.linkedin.com/posts/dilipevs_entrepreneurs-and-builders-in-healthcare-activity-7253998285718241281-CSZY?utm_source=social_share_send&utm_medium=member_desktop_web&rcm=ACoAAGEeiloBmkZ8ZCccA8Ma0SR3CJTUPo9wcrA,Dilip Kumar
Entrepreneur| Investments at Rainmatter | Endurance athlete,https://www.linkedin.com/in/dilipevs?miniProfileUrn=urn%3Ali%3Afsd_profile%3AACoAAABll5IBLSjIvTtdv-7G24ZqrORIfrfIaTY,dilipevs,urn:li:activity:7249647329790590976,regular,2024-10-09 07:10:15,1728450615356,6,116,0,74,489,20,22,5,594,"Have met over 600+ healthcare startups this year at Rainmatter. These are my general observations of the sector in 2024 so far. An investor & health enthusiast perspective. 

Remember, these are observations and not opinions.  If you’re a builder, I'm always keen to exchange notes.

1) Health tech needs maturing – The novelty phase of tech meets health is over and the focus should be on driving outcomes to the user.

2) Preventive health is gaining traction – More startups are focused on preventive solutions.

3) Nutrition personalisation is heating up – Companies are going beyond generic consulting and leveraging DNA, microbiome, or other personal data for nutrition recommendations.

4) UPI for health not yet in India- ABDM use cases haven't seen much adoption.

5) Wearables are no longer the star – Smartwatches and rings are still strong but are considered table stakes. Consumers want something that tells “why” and not limited to “what”.

6) Corporate wellness is an overrated market – With rising mental health issues, stress, and burnout in the workforce, B2B wellness solutions ideally should show promise. But there isn’t adoption from corporates.

7) The “biohacking” trend is niche but growing –longevity startups are speculative but hot.  Increasing interest in biohacking protocols (sleep optimization, anti ageing etc.). But the market is niche and often hard to validate scientifically unless clinical protocols are done.

8) Consumer trust in health supplements is dwindling – The supplement industry lacks regulation and transparency and this has eroded trust amongst consumers. Brands are focusing on science-backed products.

9) AI in healthcare – Many are bullish on AI’s potential to revolutionise diagnostics, patient care, and drug discovery, but deployment in clinical settings is slow and capital-intensive.

10) Mental health is booming – Digital mental health startups, especially those offering therapy, coaching, or CBT solutions are seeing adoptions but differentiation is becoming a challenge in a crowded market.

11) Community-driven fitness – Social, community-oriented fitness solutions still have potential if done right especially those blending real-world interactions with digital offerings.

12) CAC is a challenge for D2C health brands – Brands are facing rising customer acquisition costs often with no sustainable GTM.

13) Hybrid health businesses are scaling better – Companies combining digital and physical services have better scope of scaling fast.

14) Telehealth plateaued – The initial excitement around telehealth has subsided for both consumers and investors.

15) Health marketplaces have no moat – Platforms connecting consumers with healthcare providers or wellness services are overrated with no clear moat to grow.

There are more thoughts on this. Because of the word limit on Linkedin , can't post the remaining here. Read the whole list on https://lnkd.in/g-CTY4zC",https://www.linkedin.com/posts/dilipevs_have-met-over-600-healthcare-startups-this-activity-7249647329790590976-X6CS?utm_source=social_share_send&utm_medium=member_desktop_web&rcm=ACoAAGC0ANEB8TpzHIxGJlVGo2iJthOS_mZ_AUs,Dilip Kumar
Entrepreneur| Investments at Rainmatter | Endurance athlete,https://www.linkedin.com/in/dilipevs?miniProfileUrn=urn%3Ali%3Afsd_profile%3AACoAAABll5IBLSjIvTtdv-7G24ZqrORIfrfIaTY,dilipevs,urn:li:activity:7243842175506006016,regular,2024-09-23 06:42:38,1727066558720,0,16,78,1,163,3,1,0,245,"Bookmyshow has increased the market opportunity for meditation & mental health apps in a single day. 

If you’re a mental health startup founder and need a bigger TAM & growth just get more music bands to India.

If you’re a VC and see a spike in valuations, this is the reason.",https://www.linkedin.com/posts/dilipevs_bookmyshow-has-increased-the-market-opportunity-activity-7243842175506006016-lRuh?utm_source=social_share_send&utm_medium=member_desktop_web&rcm=ACoAAGC0ANEB8TpzHIxGJlVGo2iJthOS_mZ_AUs,Dilip Kumar
Entrepreneur| Investments at Rainmatter | Endurance athlete,https://www.linkedin.com/in/dilipevs?miniProfileUrn=urn%3Ali%3Afsd_profile%3AACoAAABll5IBLSjIvTtdv-7G24ZqrORIfrfIaTY,dilipevs,urn:li:activity:7242027721772392449,regular,2024-09-18 06:32:39,1726633959239,16,84,2,18,1565,147,31,118,1866,"For the first time in two decades I’m seeing more 20 year olds saying I want to prioritise my mental & physical health than build wealth. The era of longevity has come a full circle.

Most people start seeing their health deteriorate in their 30s & beyond.

Becoming unhealthy is not an event. It is a process. Like losing money, losing your health is rarely caused by one thing going wrong. Usually, it is a series of ignorant and wrong doings.

No matter how much money you have, how many ESOPs you earned, how great your company’s valuation soared. 

If you can’t take a walk on a random Wednesday morning or eat your breakfast without checking emails.

You’re NOT wealthy.",https://www.linkedin.com/posts/dilipevs_for-the-first-time-in-two-decades-im-seeing-activity-7242027721772392449-eEFR?utm_source=social_share_send&utm_medium=member_desktop_web&rcm=ACoAAGC0ANEB8TpzHIxGJlVGo2iJthOS_mZ_AUs,Dilip Kumar
Entrepreneur| Investments at Rainmatter | Endurance athlete,https://www.linkedin.com/in/dilipevs?miniProfileUrn=urn%3Ali%3Afsd_profile%3AACoAAABll5IBLSjIvTtdv-7G24ZqrORIfrfIaTY,dilipevs,urn:li:ugcPost:7240276642466521088,regular,2024-09-13 10:34:29,1726216469729,14,10,0,0,168,14,1,4,200,"A lot of good can happen to India and our culture when more people play sports and that creates future athletes. There is a special emotion in seeing Indian flag on global sports map.

In all my conversations with professional athletes, the common request has been for consistent support for their pursuits—not just financial, but also cheering for their smaller wins and being on their side when they don't make it to the podium. 

India has the sports talent but we also need a support system and processes to guide and anchor these athletes continuously. We are excited to partner with the GoSports foundation, who are doing this and more towards athlete development and support.

Yesterday, we met a few Olympians and Paralympians, and all of them had a common goal- to make India proud. At Rainmatter by Zerodha we are cheering for them and the team at GoSports Foundation. 

Deepthi Bopaiah, Nandan Kamath",https://www.linkedin.com/posts/dilipevs_a-lot-of-good-can-happen-to-india-and-our-activity-7240276643850674176-wi_4?utm_source=social_share_send&utm_medium=member_desktop_web&rcm=ACoAAGC0ANEB8TpzHIxGJlVGo2iJthOS_mZ_AUs,Dilip Kumar
Entrepreneur| Investments at Rainmatter | Endurance athlete,https://www.linkedin.com/in/dilipevs?miniProfileUrn=urn%3Ali%3Afsd_profile%3AACoAAABll5IBLSjIvTtdv-7G24ZqrORIfrfIaTY,dilipevs,urn:li:activity:7235885164088737792,regular,2024-09-01 07:44:19,1725169459364,3,37,207,2,333,13,1,2,560,"Been 12 months I've been active on social media. Few things are evident. 

Instagram: where average people pretend to be millionaires.
Twitter: where millionaires pretend to be average people.
Linkedin: where millions of people pretend to be both.",https://www.linkedin.com/posts/dilipevs_been-12-months-ive-been-active-on-social-activity-7235885164088737792-fUFt?utm_source=social_share_send&utm_medium=member_desktop_web&rcm=ACoAAGC0ANEB8TpzHIxGJlVGo2iJthOS_mZ_AUs,Dilip Kumar
Entrepreneur| Investments at Rainmatter | Endurance athlete,https://www.linkedin.com/in/dilipevs?miniProfileUrn=urn%3Ali%3Afsd_profile%3AACoAAABll5IBLSjIvTtdv-7G24ZqrORIfrfIaTY,dilipevs,urn:li:activity:7232971339920252929,regular,2024-08-24 06:45:49,1724474749546,3,37,0,0,237,25,2,6,271,"Back in the days buying milk was fun. Walk for 20mins to the booth. Exchange currency to get coins. Put each coin in the machine  and wait for the milk. Sometimes do it for others because it gave feelings like playing video games. All the fun is ruined now. Open the door & milk packet is on the doormat. 

This generation might not even know what this feeling was.",https://www.linkedin.com/posts/dilipevs_back-in-the-days-buying-milk-was-fun-walk-activity-7232971339920252929-mrQd?utm_source=social_share_send&utm_medium=member_desktop_web&rcm=ACoAAGC0ANEB8TpzHIxGJlVGo2iJthOS_mZ_AUs,Dilip Kumar
Entrepreneur| Investments at Rainmatter | Endurance athlete,https://www.linkedin.com/in/dilipevs?miniProfileUrn=urn%3Ali%3Afsd_profile%3AACoAAABll5IBLSjIvTtdv-7G24ZqrORIfrfIaTY,dilipevs,urn:li:activity:7232254341938655232,regular,2024-08-22 07:16:43,1724303803906,1,39,0,0,150,14,4,6,171,"Founders in Mumbai, lets meet! If you are building products to help people stay healthy & fit, I would like to meet you. Rainmatter Health is a venture fund supporting companies making Indians healthy. 

This is the first time we’re doing a meetup in Mumbai. Did one in Delhi few months back and it was super fun.

This is going to be casual gathering to meet founders, builders and creators building solutions in healthcare. Anything that helps Indians to stay healthy mentally and physically. You could be building in nutrition, health tech, sports or fitness. We could use the time to exchange notes and brainstorm on any problem statement you've in your startup/product. I'll share our thoughts and observations at Rainmatter.
Date : 28th August. Exact venue will be sent post signup. 

Register here to attend the event : https://lu.ma/alnejly3

If you know any founder in Mumbai who could come, pls share it with them. 
See you in Mumbai :)",https://www.linkedin.com/posts/dilipevs_founders-in-mumbai-lets-meet-if-you-are-activity-7232254341938655232-jS9s?utm_source=social_share_send&utm_medium=member_desktop_web&rcm=ACoAAGC0ANEB8TpzHIxGJlVGo2iJthOS_mZ_AUs,Dilip Kumar
Entrepreneur| Investments at Rainmatter | Endurance athlete,https://www.linkedin.com/in/dilipevs?miniProfileUrn=urn%3Ali%3Afsd_profile%3AACoAAABll5IBLSjIvTtdv-7G24ZqrORIfrfIaTY,dilipevs,urn:li:ugcPost:7230804320017899520,regular,2024-08-18 07:17:05,1723958225805,4,14,1,2,111,5,4,2,125,"Decoding the market for packaged foods in India. And why two IIT grads who went to Harvard and IIM wants to give you better options to eat healthy. 

In this podcast i’m talking to Ahana Gautam founder of Open Secret and Sudarshan Gangrade founder of Bajo Foods.  

This episode is a business breakdown on building a healthy eating category in India. Everything you should know about creating food products, understanding consumer behaviour, pricing, distribution , surviving and winning an extremely competitive market segment. 

Some numbers to give you context :
Package food industry in India will be $186 billion market.
Chocolates is $3.8 billion & Snacks is $5.3 billion. 
Is there an opportunity to create healthier alternatives. 

Can new startups win consumer adoption in a market that is extremely competitive and has large incumbent players? Why should India eat healthy?

Watch the full episode here https://lnkd.in/gyn6r5BY",https://www.linkedin.com/posts/dilipevs_decoding-the-market-for-packaged-foods-in-activity-7230804882327228416-WI7T?utm_source=social_share_send&utm_medium=member_desktop_web&rcm=ACoAAGC0ANEB8TpzHIxGJlVGo2iJthOS_mZ_AUs,Dilip Kumar
Entrepreneur| Investments at Rainmatter | Endurance athlete,https://www.linkedin.com/in/dilipevs?miniProfileUrn=urn%3Ali%3Afsd_profile%3AACoAAABll5IBLSjIvTtdv-7G24ZqrORIfrfIaTY,dilipevs,urn:li:activity:7226086503972581378,regular,2024-08-05 06:47:56,1722833276742,8,20,0,0,217,33,2,2,260,"A good coach can change the game. A great coach can change the life. That's Indian Hockey coach Craig Fulton trying to meet his daughter after the win against Great Britain at Olympics yesterday.  

A coach is the anchor to bridge the gap between aspirations and commitment. You don't know what it means to be great unless you have a coach besides you. Everyone needs a coach. At work or playground.",https://www.linkedin.com/posts/dilipevs_a-good-coach-can-change-the-game-a-great-activity-7226086503972581378-x9EU?utm_source=social_share_send&utm_medium=member_desktop_web&rcm=ACoAAGC0ANEB8TpzHIxGJlVGo2iJthOS_mZ_AUs,Dilip Kumar
Entrepreneur| Investments at Rainmatter | Endurance athlete,https://www.linkedin.com/in/dilipevs?miniProfileUrn=urn%3Ali%3Afsd_profile%3AACoAAABll5IBLSjIvTtdv-7G24ZqrORIfrfIaTY,dilipevs,urn:li:ugcPost:7225731343790305280,regular,2024-08-04 07:17:43,1722748663219,6,27,1,10,599,31,25,9,656,"1.4 billion people and 117 athletes. This podcast is to understand Indian sports, governance & infrastructure. And how do we bridge the gap between potential and commitment to olympic aspirations.

I’m talking Deepthi Bopaiah, CEO of GoSports Foundation. She has spent many years in identifying and supporting talent for Indian sports.
This episode will tell you more about
-Sports governance  in India and how it works.
-Current infrastructure and what could be done to improve.
-Stories about women and parathletes in Indian sports you never knew.
-Toolkits for young athletes and their parents to pursue sports as professional career.
-And how we can create better systems to have more olympic medal potentials.

Watch the full podcast here https://lnkd.in/gYKVSwnJ

Do me a favour and please share it with an aspiring athlete or a parent who has dreams to make a kid play sports for India.",https://www.linkedin.com/posts/dilipevs_14-billion-people-and-117-athletes-this-activity-7225731609134522368-JiE6?utm_source=social_share_send&utm_medium=member_desktop_web&rcm=ACoAAGC0ANEB8TpzHIxGJlVGo2iJthOS_mZ_AUs,Dilip Kumar
Entrepreneur| Investments at Rainmatter | Endurance athlete,https://www.linkedin.com/in/dilipevs?miniProfileUrn=urn%3Ali%3Afsd_profile%3AACoAAABll5IBLSjIvTtdv-7G24ZqrORIfrfIaTY,dilipevs,urn:li:ugcPost:7225004732379979777,regular,2024-08-02 07:09:24,1722575364906,12,55,0,0,255,30,1,3,300,"Employee health & fitness shouldn’t be complicated. It should be simple and it should be a culture.

We had a random internal chat on world record for push-ups. And decided to check how many we can do in a minute. This is a video from that 😊

No HR was involved. There was no cash prize, no incentives, no leaderboard. No one was forced but most chose to do.

Employee health shouldn’t be limited to one yoga day or world health day. It should be a regular conversation. It should be driven by everyone from top to bottom. Don’t over engineer it with too many wellness programs. Keep it simple. Make it a culture. 

Zerodha | Rainmatter by Zerodha",https://www.linkedin.com/posts/dilipevs_employee-health-fitness-shouldnt-be-complicated-activity-7225004743327113216-dbOi?utm_source=social_share_send&utm_medium=member_desktop_web&rcm=ACoAAGC0ANEB8TpzHIxGJlVGo2iJthOS_mZ_AUs,Dilip Kumar
Entrepreneur| Investments at Rainmatter | Endurance athlete,https://www.linkedin.com/in/dilipevs?miniProfileUrn=urn%3Ali%3Afsd_profile%3AACoAAABll5IBLSjIvTtdv-7G24ZqrORIfrfIaTY,dilipevs,urn:li:activity:7221742252937633792,regular,2024-07-24 07:05:26,1721797526583,33,30,0,2,251,43,1,7,336,"Everytime you hear this crap, women shouldn’t lift weights. Ignore & just remember these women. 

These are Olympic and World champions 🇮🇳. Because they lift weights. 

Next time you see a woman walk into a gym, cheer for her. Offer her help. She will feel confident. She will come back again.

No one has ever said, I don’t want to feel strong.",https://www.linkedin.com/posts/dilipevs_everytime-you-hear-this-crap-women-shouldn-activity-7221742252937633792--rZ6?utm_source=social_share_send&utm_medium=member_desktop_web&rcm=ACoAAGC0ANEB8TpzHIxGJlVGo2iJthOS_mZ_AUs,Dilip Kumar
Entrepreneur| Investments at Rainmatter | Endurance athlete,https://www.linkedin.com/in/dilipevs?miniProfileUrn=urn%3Ali%3Afsd_profile%3AACoAAABll5IBLSjIvTtdv-7G24ZqrORIfrfIaTY,dilipevs,urn:li:activity:7221012947748208643,regular,2024-07-22 06:47:26,1721623646676,98,58,0,2,1021,80,7,37,1238,"Cricket should support other sports in India. I wrote about this two weeks ago. Some supported and others critiqued. 

Yesterday BCCI announced a 8.5cr support to Indian athletes going to Paris olympics.

This was the original tweet that went viral https://lnkd.in/gU4JFxr9

Most people are afraid of sharing their thoughts online. One of the biggest mistake is that people think they have to be an ""expert"" to share about something. 
I'm telling you, the power of speaking your mind is underrated. 

Appreciate the gesture by Board of Control for Cricket in India (BCCI).

Hope more will come out to support Indian sports.",https://www.linkedin.com/posts/dilipevs_cricket-should-support-other-sports-in-india-activity-7221012947748208643-X4Lp?utm_source=social_share_send&utm_medium=member_desktop_web&rcm=ACoAAGC0ANEB8TpzHIxGJlVGo2iJthOS_mZ_AUs,Dilip Kumar
Entrepreneur| Investments at Rainmatter | Endurance athlete,https://www.linkedin.com/in/dilipevs?miniProfileUrn=urn%3Ali%3Afsd_profile%3AACoAAABll5IBLSjIvTtdv-7G24ZqrORIfrfIaTY,dilipevs,urn:li:activity:7212311569286746112,regular,2024-06-28 06:31:16,1719549076387,0,36,0,25,212,7,3,20,264,"AI & ChatGPT will not solve for this. You have to. Becoming unfit is not an event. It is a process.

-Prioritise physical activity. Nothing is more important.
-Eat healthy. Don’t be the profit machine to processed & packaged industry.

Your only goal should be to be in your kids & partners life as long as you can.

Like loosing money, loosing your health is rarely caused by one thing going wrong. Usually, it is a series of ignorance and wrong doings. Take control now.

If you wait until you're motivated, you’ve already lost.",https://www.linkedin.com/posts/dilipevs_ai-chatgpt-will-not-solve-for-this-you-activity-7212311569286746112-hqX6?utm_source=social_share_send&utm_medium=member_desktop_web&rcm=ACoAAGC0ANEB8TpzHIxGJlVGo2iJthOS_mZ_AUs,Dilip Kumar
Entrepreneur| Investments at Rainmatter | Endurance athlete,https://www.linkedin.com/in/dilipevs?miniProfileUrn=urn%3Ali%3Afsd_profile%3AACoAAABll5IBLSjIvTtdv-7G24ZqrORIfrfIaTY,dilipevs,urn:li:activity:7210866833644564480,regular,2024-06-24 06:50:24,1719204624568,13,70,0,3,364,30,1,3,413,"Bring a bunch of founders under one roof, let them talk to each other, give no gyaan. And magic will happen. Last Friday was this. 
Did an impromptu Health Founders meet-up in Delhi last Friday. 180+ people signed up. Could only admit 40 due to space limitations. All of them showed up and few brought their co-founders along.

I thought events and meet-ups were in abundance. Maybe 5-10 people will turn up. But 50 founders were hanging out for 4 hrs on a Friday evening. And all passionate about health and building products to make Indians healthy. 

There was no speech, no panel, no agenda. 
But entrepreneurs have an innate ability to communicate. So they all started talking to each other. Figured that networking is overrated. But a space to have unfiltered conversations and be your authentic is underrated. 

Some got new customers.
Some met their customers who were using their products. 
Some got offer to share the office space.
Some validated their new product ideas.
Some established new partnerships. 
Lot of questions on why, what and how. 
And a few made their funding pitch. Founder preamble you know :) 
There was learning and a some unlearning. 

Apologies for people we couldn’t admit. There was a genuine space limitation. 
It was an experiment and i dint expect this much response. 

At Rainmatter our credo is to add meaningful support to the ecosystem. 
Either through capital allocation or cheering for entrepreneurs. 
Should we do this more often? In other cities?",https://www.linkedin.com/posts/dilipevs_bring-a-bunch-of-founders-under-one-roof-activity-7210866833644564480-QWmF?utm_source=social_share_send&utm_medium=member_desktop_web&rcm=ACoAAGC0ANEB8TpzHIxGJlVGo2iJthOS_mZ_AUs,Dilip Kumar
Entrepreneur| Investments at Rainmatter | Endurance athlete,https://www.linkedin.com/in/dilipevs?miniProfileUrn=urn%3Ali%3Afsd_profile%3AACoAAABll5IBLSjIvTtdv-7G24ZqrORIfrfIaTY,dilipevs,urn:li:activity:7201805723964514304,regular,2024-05-30 06:44:47,1717044287673,309,64,0,10,7139,521,63,75,8054,"Behind every star athlete or a champion there is a supporting family. 
Parents who teach their kids that success is not about winning but how well they can recover when they fall. 

This is Nagalakshmi. An unassuming mother of two young Indian chess prodigies Praggnanandhaa and Vaishali. The first-ever brother-sister duo to both earn the Grand master title. Today both of them are well known for their achievements in the sport. Most don’t know that their mother, Nagalakshmi accompanies them to tournaments for encouragement and support. Father Rameshbabu works as a branch manager at TNSC Bank and is honest to say they were facing financial constraints but were determined to support both their kids. 

I’ve now spent time with Olympians, World champions & India no.1 on my podcast and a common thread amongst all of them is their early childhood and the parental support all of them had.  The most important economic decisions a society makes are not made in corporate offices, but in homes.
https://x.com/kmr_dilip",https://www.linkedin.com/posts/dilipevs_behind-every-star-athlete-or-a-champion-there-activity-7201805723964514304-ojcg?utm_source=social_share_send&utm_medium=member_desktop_web&rcm=ACoAAGC0ANEB8TpzHIxGJlVGo2iJthOS_mZ_AUs,Dilip Kumar
Entrepreneur| Investments at Rainmatter | Endurance athlete,https://www.linkedin.com/in/dilipevs?miniProfileUrn=urn%3Ali%3Afsd_profile%3AACoAAABll5IBLSjIvTtdv-7G24ZqrORIfrfIaTY,dilipevs,urn:li:activity:7185511912204316672,regular,2024-04-15 07:39:00,1713159540225,2,67,0,23,315,10,3,6,356,"Have met 500+ startups solving for health, nutrition & fitness in last 12 months at Rainmatter. There is an opportunity no one is looking at. My thoughts....

Those building tech mostly tell HOW is the sleep, blood glucose , calories, HRV , recovery and more. Your current baseline. That's the current generation of wearables. 

But no is telling WHY it's happening. 
I think this will be the future of health wearables. 

Those building food products claim THEY are healthy & better. 
But no one is telling WHY they are better.

I think solving for WHY will unlock new market opportunities . 
How & What will get you first time customer. 
Why will get you lifetime user.

Usecase: If the RHR (resting heart rate) suddenly spikes, we should know why.
If the HRV dropped, we should know what caused it.

Shared some other opportunities earlier here https://lnkd.in/gn6ibaGj",https://www.linkedin.com/posts/dilipevs_have-met-500-startups-solving-for-health-activity-7185511912204316672-Vrfu?utm_source=social_share_send&utm_medium=member_desktop_web&rcm=ACoAAGC0ANEB8TpzHIxGJlVGo2iJthOS_mZ_AUs,Dilip Kumar
Entrepreneur| Investments at Rainmatter | Endurance athlete,https://www.linkedin.com/in/dilipevs?miniProfileUrn=urn%3Ali%3Afsd_profile%3AACoAAABll5IBLSjIvTtdv-7G24ZqrORIfrfIaTY,dilipevs,urn:li:activity:7180065826794868736,regular,2024-03-31 06:58:12,1711861092280,4,17,0,0,99,13,0,0,116,Doing a podcast with Narain Karthikeyan next week. What should I ask him? This is his first podcast ever.,https://www.linkedin.com/posts/dilipevs_doing-a-podcast-with-narain-karthikeyan-next-activity-7180065826794868736-sIqG?utm_source=social_share_send&utm_medium=member_desktop_web&rcm=ACoAAGEsG0ABFmlmZye_QBC9XS6e4FtMFn7apC0,Dilip Kumar
