Full Name,Profile URL,Headline,Comment,Timestamp,Comment URN,Comment Hash,Post URN,Post Hash,post_urn_id,processed_comment,sentiment_negative,sentiment_neutral,sentiment_positive,sentiment_compound,sentiment_label
Shriram Ramdas,https://www.linkedin.com/in/shriramramdas,Founder & CEO at The Little Gym & The Yard | Reach out to unlock the power of Youth Development and elevate Indian sports,Something to say about us Indians respecting Wisdom and Elders...,2023-12-19T08:46:23.054Z,"urn:li:comment:(activity:7140931872661962753,7142797299901988865)",e08b75518955cd5453235d215ebdceaabe496313255f35d9b6539802a3d9ae3f,urn:li:activity:7140931872661962753,f8a103f527602a7a74fd56f6f281c0777038ba1bdc06a35b1ed2f6ada6bea51e,7140931872661962753,something to say about us indians respecting wisdom and elders,0.0,0.548,0.452,0.765,Positive
"Dr. Janani Manoharan M.D (OG), MRCOG, D.MAS, F.MAS, FICRS, F.ART",https://www.linkedin.com/in/jananimanoharan,"Obstetrician, Gynaecologist, Laparoscopic and Robotic Surgeon, Infertility Specialist","Lol... It can also be our fascination with giving anything Western an immediate revered status!! Not to belittle his achievements, although I doubt if he would get the same amount of adulation from us if he was Indian. ",2023-12-15T02:12:01.954Z,"urn:li:comment:(activity:7140931872661962753,7141248506597416960)",417c5f8642df765ed47b7d547113bbf81ae5f6372cbec37b36fdb337e8f85b71,urn:li:activity:7140931872661962753,f8a103f527602a7a74fd56f6f281c0777038ba1bdc06a35b1ed2f6ada6bea51e,7140931872661962753,lol it can also be our fascination with giving anything western an immediate revered status not to belittle his achievements although i doubt if he would get the same amount of adulation from us if he was indian,0.053,0.651,0.296,0.8911,Positive
Subba Yantra,https://www.linkedin.com/in/subbayantra,"Founder & CEO Zaspar Technologies Promoter Director & Head --Global Sales, IT-Mohan Spintex",This mentality of Indian middle class is the only hope for 1.4 billion Indians rather than the government’s and bureaucracy,2023-12-14T16:33:12.835Z,"urn:li:comment:(activity:7140931872661962753,7141102842114695168)",d9c4a30573a009d9c34aae917879cbf7efef29d37fb582af1beb52bd157f8151,urn:li:activity:7140931872661962753,f8a103f527602a7a74fd56f6f281c0777038ba1bdc06a35b1ed2f6ada6bea51e,7140931872661962753,this mentality of indian middle class is the only hope for billion indians rather than the governments and bureaucracy,0.0,0.861,0.139,0.4404,Positive
Shivali Vij,https://www.linkedin.com/in/shivali-vij,Driving Strategy with AI & Analytics @ Michelin | Ex- BCG | IIM-L,"We are his fans - No doubt ! He was risk averse, intellectual, Loyal, loved to read , promotes being a nerd - What more to ask for ?",2023-12-14T13:28:45.996Z,"urn:li:comment:(activity:7140931872661962753,7141056424427663361)",e7c0541d07764d77f38bfee7add82f60ef96d2b90fe484db791c316da866603a,urn:li:activity:7140931872661962753,f8a103f527602a7a74fd56f6f281c0777038ba1bdc06a35b1ed2f6ada6bea51e,7140931872661962753,we are his fans no doubt he was risk averse intellectual loyal loved to read promotes being a nerd what more to ask for,0.245,0.409,0.346,0.6908,Positive
Adarsh Gopalakrishnan,https://www.linkedin.com/in/adarshgopalakrishnan,Movement inc,"Dilip KumarThank you for sharing this amazing interview. His writing style was sensational too. Amazing story teller. His parody of the Great Recession remains a favourite: https://slate.com/business/2011/07/charles-munger-s-parody-a-story-about-wantmore-tweakmore-totalscum-and-the-tragedy-of-the-great-recession.html

There's also his writing on trade. And I love his observations on Lee Kuan Yew and the accomplishments of Singapore. He was a polymath who got things done. ",2023-12-14T05:43:07.744Z,"urn:li:comment:(activity:7140931872661962753,7140939242901348352)",81edb40899da52ff5f5dd2333385dbd21f5fc06d03fecb8c9d07730e33464dc2,urn:li:activity:7140931872661962753,f8a103f527602a7a74fd56f6f281c0777038ba1bdc06a35b1ed2f6ada6bea51e,7140931872661962753,dilip kumarthank you for sharing this amazing interview his writing style was sensational too amazing story teller his parody of the great recession remains a favourite theres also his writing on trade and i love his observations on lee kuan yew and the accomplishments of singapore he was a polymath who got things done,0.041,0.663,0.296,0.9601,Positive
Akhil R,https://www.linkedin.com/in/theakhilr,Storyteller & Marketing Strategist | 2+ Years Client Retention Delivering LinkedIn Content & Audience Growth | Social Impact Advocate,"There is a lot to learn from Charlie and Warren, in my perspective it is, mostly their risk taking ability that we all are fond of right?

and I believe, young Indians, are way more risk taking than any other generation, and that's why we love learning from them.",2023-12-14T05:22:58.411Z,"urn:li:comment:(activity:7140931872661962753,7140934170595303425)",7fd42a148804229ccbdbbb289e60f9753b82e4b83a604ece5f345b892dd6f2e2,urn:li:activity:7140931872661962753,f8a103f527602a7a74fd56f6f281c0777038ba1bdc06a35b1ed2f6ada6bea51e,7140931872661962753,there is a lot to learn from charlie and warren in my perspective it is mostly their risk taking ability that we all are fond of right and i believe young indians are way more risk taking than any other generation and thats why we love learning from them,0.076,0.755,0.169,0.7351,Positive
